,index,Processed Tweets
1481,1481,onlin class boy mom babi luca read play hahahahahahaha
1482,1482,bought ootd excit cloth bought onlin class
1483,1483,time slept onlin class
1484,1484,aww gac onlin class kmo
1485,1485,hard mode data onlin class
1486,1486,onlin class delici
1487,1487,nephew sleep onlin class
1488,1488,tire onlin class jusq
1489,1489,onlin class mcb anyareh
1490,1490,pwd mom nephew onlin class sister brave life town leni lift lenikiko leniforpresid tomorrow pink
1491,1491,breakfast onlin class
1492,1492,tour guid hahaha onlin class fill answer
1493,1493,feel colleg learn onlin class
1494,1494,excit cap nervou duti onlin class enggk
1495,1495,teacher est admin fun onlin class night bingo enjoy lot
1496,1496,onlin class allow activ onlin lol
1497,1497,mami leni experienc poor internet connect mood hahaha onlin class ksksksk discuss lag
1498,1498,sleep onlin class decid sleep tomorrow
1499,1499,onlin class start electr farm wifi imagin joshua jolea jami edwin wifi pray lord listen
1500,1500,bbm onlin class excus absenc fail grade marco coward backout leni brave leni lag
1501,1501,onlin class tomorrow
1502,1502,onlin class maree
1503,1503,naol tite onlin class
1504,1504,hey onlin class woke
1505,1505,gift onlin class time
1506,1506,soc med break tempt onlin class
1507,1507,onlin class nutshel kasarap
1508,1508,onlin class
1509,1509,purchas onlin class
1510,1510,onlin class month
1511,1511,onlin class suffer plss finish huhu
1512,1512,choos album onlin class
1513,1513,onlin class week
1514,1514,onlin class
1515,1515,bad steal send money load onlin class repli mom
1516,1516,complaint onlin class push access doubl teacher tbh
1517,1517,birthday gift fair cod haha kid appreci bond paper onlin class camera
1518,1518,favor onlin class
1519,1519,onlin class
1520,1520,shakey store onlin class jaajjakajsjsj
1521,1521,call attent student onlin class friend globe prepaid wifi choos stori student
1522,1522,decid chose onlin class know kay nibalhin nalang sab onlin hahah labyu girl
1523,1523,onlin class
1524,1524,onlin class laptop
1525,1525,onlin class join onlin mass person lot angri deadli question
1526,1526,danc onlin class
1527,1527,onlin class pasmo
1528,1528,today onlin class
1529,1529,pandem happen care mental health onlin class
1530,1530,hey subscrib southern cebu wifi connect odetteph electr water internet onlin class
1531,1531,enrol readi onlin class drain energi aeon
1532,1532,hope allow onlin class
1533,1533,listen nephew onlin class math subject eng follow formula equat
1534,1534,onlin class modul hard poor
1535,1535,onlin class game
1536,1536,onlin class antineg lamp proven lamp useless
1537,1537,onlin class
1538,1538,stay sleep onlin class
1539,1539,sem onlin class pist yawa lits anim
1540,1540,onlin class
1541,1541,onlin class
1542,1542,woke shower onlin class
1543,1543,wazzup alien angel late wahahaha woke late class onlin kokoy marspamor funfriday
1544,1544,terribl receiv support moral financi essenti onlin class
1545,1545,sister start onlin class australian technic colleg delsi
1546,1546,hard onlin class
1547,1547,onlin class
1548,1548,prepar onlin class tomorrow danay start lantaw season sang demon slayer haha
1549,1549,onlin class confus
1550,1550,school class schedul onlin job extra school expens time
1551,1551,nice onlin class
1552,1552,onlin class
1553,1553,onlin class start
1554,1554,day onlin class sem product
1555,1555,graduat colleg onlin onlin class workforc
1556,1556,readi tomorrow onlin class philosophi intersubject
1557,1557,life think deactiv social medium account onlin class time
1558,1558,ahay grace myrtl pasion enter onlin class
1559,1559,medjo messi tabl onlin class class sir pictur manag time nextatac acerblowoutday psst
1560,1560,medjo messi tabl onlin class class sir pictur manag time nextatac acerblowoutday psst
1561,1561,esp cours lack hand experi lectur modul fool attend onlin class compli requir
1562,1562,save keith god provid hope onlin class save money luck god bless keith
1563,1563,tangina super obvi class mental holi shit onlin class season shit
1564,1564,onlin class gab enter meet
1565,1565,lazi run time focu onlin class enter mind studi
1566,1566,talk student class lesson onlin setup person amp famili issu agre rais grade push student limit care
1567,1567,requir onlin class walk
1568,1568,onlin class practicum monday tuesday
1569,1569,lazi sem late nervou sleep soundli onlin class youuu hihi
1570,1570,onlin class eme hahahahahahah
1571,1571,notifi account shut grrr onlin class grrr delet forgot password
1572,1572,student onlin class tomorrow googl classroom
1573,1573,skin onlin class
1574,1574,onlin class space hahah
1575,1575,absent onlin class tax evas hahahahaha disqualifybbm disqualifymarco
1576,1576,class stop covid transmit onlin
1577,1577,invest onlin class
1578,1578,onlin class guidanc
1579,1579,tulog movi seri vape kain onlin class repeat sem pla ramdam taena mag learn
1580,1580,time sleep onlin class straight duti mom
1581,1581,polish tiktok onlin class
1582,1582,pandem onlin class studi friend cellphon hand wake close eye morn
1583,1583,fight onlin class sore throat
1584,1584,mama student lead prayer onlin class grade child lord hope
1585,1585,putangina bat class thursday onlin scare
1586,1586,resolut hard studi learn onlin class
1587,1587,readi onlin class haha
1588,1588,jusko tuition onlin class
1589,1589,onlin class bitch
1590,1590,hope entranc onlin class extend happen
1591,1591,luxuri file loa tbf prof lang tho record yun lang onlin class tax
1592,1592,gage lost signal onlin class gage
1593,1593,stay safe covid god onlin class queen care
1594,1594,day onlin class
1595,1595,onlin class prayer sweet ear heart
1596,1596,friend particip onlin class modul
1597,1597,onlin class topic
1598,1598,sale month samsung lite tab origin unusu charger worth case temper glass smooth damag hidden issu brand onlin class game loc cruz pasaymalibay nagagamit detail
1599,1599,time hard tomorrow' onlin class
1600,1600,account temporarili unavail violat twitter medium polici learn
1601,1601,comeback fun onlin class
1602,1602,onlin class practic understand
1603,1603,onlin class pictur
1604,1604,teacher consider onlin class difficult
1605,1605,nauruugto dae iko fall onlin class meooow hahahaha
1606,1606,day zombi apocalyps onlin class edit
1607,1607,drunk onlin class hahahahahaha
1608,1608,onlin class mother
1609,1609,onlin class
1610,1610,start dream phone alarm watch onlin class
1611,1611,onlin class
1612,1612,onlin class lazi studi hard
1613,1613,onlin class guy
1614,1614,forgot onlin class
1615,1615,smell onlin class season hope
1616,1616,hey onlin class readi
1617,1617,congratul beatric isabel onlin class batch pass ascpi exam enrol ascpi amt dohad onlin review class set competit
1618,1618,congratul maria loreina cruz onlin class batch pass ascpi exam enrol ascpi amt dohad onlin review class set competit
1619,1619,trial class decemb eager embark french adventur stay onlin afm book seat dec pmpm level beginn durat hour price php onlin afmtrial
1620,1620,hey hotspot laptop onlin class money onlin ftf setup
1621,1621,sleepi nap onlin class tomorrow
1622,1622,onlin class tesda' food start
1623,1623,crux onlin class
1624,1624,onlin class hahahahaha
1625,1625,earthquak onsit class suspend class onlin class continu lectur
1626,1626,car attend onlin class particip swim
1627,1627,congratul
1628,1628,congratul fight
1629,1629,congratul
1630,1630,congratul
1631,1631,congratul
1632,1632,congratul
1633,1633,congratul
1634,1634,congratul
1635,1635,congratul
1636,1636,
1637,1637,motiv licens
1638,1638,dzaee giaatyy hahahahahaha set alarm onlin class sleep o'clock hahahhahahahah time meet hahahhahahahahaha time eye meet start hahahahahahahahahahahahahahahahah
1639,1639,zombi mode onlin class
1640,1640,frustrat onlin class internet bug
1641,1641,hour connect onlin class attend class absent night plan
1642,1642,congratul czarina macasaquit onlin class batch pass ascpi exam enrol ascpi amt dohad onlin review class set competit
1643,1643,professor attend complet onlin class annoy
1644,1644,onlin class
1645,1645,onlin class overtim sleepi
1646,1646,activ class hour onlin class
1647,1647,onlin meet crimin law class
1648,1648,day peopl onlin class struggl happi bond includ person struggl remov hard
1649,1649,wait onlin class week
1650,1650,lose motiv nice card achiev hard onlin class
1651,1651,bring onlin class
1652,1652,higa onlin class hahahahhahahaah
1653,1653,
1654,1654,term ust adopt combin onsit onlin class hour vice rector academ affair prof cheryl peralta told varsitarian
1655,1655,claim topnotch topnotch claim manifest pnle board passer topnotch cuti
1656,1656,day day tueskumon onlin class kumonphilippin
1657,1657,plm onlin class
1658,1658,nathan onlin class mama duti
1659,1659,yuppp onlin class start hahahahaha
1660,1660,function wellbut god understandingbcoz happen kid classw drove kuya fun school fairlittl girl stay tasksno class thur onlin fri sulk sad wait
1661,1661,yehey month onlin class laptop hahaha
1662,1662,onlin class nervou
1663,1663,onlin class discuss morn corpor meet feel
1664,1664,onlin class birthday hehe wabyu check charl kieron video tiktok
1665,1665,regularli govt agenc close interact lost class addit class onlin offer random kind
1666,1666,onlin class tomorrow
1667,1667,
1668,1668,sister onlin class
1669,1669,onlin class leader onlin class
1670,1670,surpris mare onlin class manag
1671,1671,onlin class expens answer
1672,1672,jctic offer intak learn japanes feel contact direct messag twitter whatsapp offer onlin class
1673,1673,onlin class narian admiss oflov janeshua darnaaftereffect
1674,1674,excit lost onlin class sheeettt
1675,1675,admit cut class shop shop internet cafe famou onlin game peso internet game hour share shop memori republicasia
1676,1676,haha talent break onlin class
1677,1677,wander time onlin class feel time
1678,1678,pmp review onlin class januari feb amnn
1679,1679,pretend game log onlin class
1680,1680,lot huuug
1681,1681,onlin class era week built
1682,1682,onlin class ramu todeh
1683,1683,break session lalo onlin class stress teacher student
1684,1684,play speaker onlin class play jeje song
1685,1685,monday class onlin bore
1686,1686,messag abt night shock talk dept student real reason delay suck peopl talk know true
1687,1687,hangov onlin class
1688,1688,onlin class school practic wors potangina
1689,1689,finmar onlin class
1690,1690,mental drain onlin class
1691,1691,lot gossip circl school student fail pnle roster passer file board exam quick gossip
1692,1692,tomorrow monday offic onlin class focu priorit
1693,1693,save onlin class
1694,1694,onlin class week
1695,1695,onlin class
1696,1696,onlin class
1697,1697,onlin class enjoy queue hahay
1698,1698,onlin class hay
1699,1699,lazi onlin class
1700,1700,onlin class suddenli exam
1701,1701,agenda tomorrow attend onlin servic attend review class overtim coz monday deadlin start wrap gift sobrang busi decemb
1702,1702,onlin class
1703,1703,tinee onlin class food
1704,1704,contribut prayer onlin class
1705,1705,reason lord' delay plan onlin class internet connect mbp
1706,1706,peopl read kinder niec onlin class elementari
1707,1707,leav onlin class life
1708,1708,onlin class deaf
1709,1709,bore yesterday subject day even class subject submit onlin
1710,1710,hurt read email sir task time attend onlin class manag time hope understand choic studi time understand
1711,1711,lectur network disconnect onlin class space
1712,1712,playgroup class sister onlin hihi enrol
1713,1713,hahxhshshsh onlin class rad glass
1714,1714,brother onlin class nois connect speaker listen prof judg heard provis rememb busi law subject
1715,1715,main reason mom onlin class
1716,1716,sister stop class onlin sem feel medicin
1717,1717,onlin class hahahaha
1718,1718,lot transact head teller class branch onlin touch pota
1719,1719,class onlin class week wild
1720,1720,induct session onlin class
1721,1721,woman talk time onlin class dem dey air
1722,1722,hire onlin class job offer
1723,1723,onlin mode class lazi teacher left unsupervis
1724,1724,onlin class
1725,1725,cousin laugh onlin class teacher report hahahhahahahaa
1726,1726,onlin class
1727,1727,listen onlin class gossip
1728,1728,brother hahah rememb onlin class brother school onlin class asleep
1729,1729,histori class onlin onli
1730,1730,reaction onlin class
1731,1731,frustrat phone onlin class colleg stupid phone attend class
1732,1732,onlin class worth
1733,1733,yesterday load onlin class report overtim
1734,1734,professor remedi law review decid class offici schedul hard start realiz wake
1735,1735,choos institut gain experi graduat onlin class choic choos
1736,1736,apaang ankga app joyrid book entertain theater novalich pass par onlin class ongo log properli listen teacher buzz noisi
1737,1737,onlin class connect time
1738,1738,topnotch pass rate onlin class opportun teach commun health nurs congratul
1739,1739,onlin class
1740,1740,hey friend highearn freelanc copywrit mentor onlin class start week kasama rin magig classmat send messag
1741,1741,agap tomorrow onlin class
1742,1742,feel lot overlap level design feng zhu specif onlin school fzd term teach class talent student gorgeou
1743,1743,read culinari school pari creation uncommon classpricey peopl popup store amp onlin wud expand south east asian countriesdito philippin macaron fave
1744,1744,heysss delet socm hshshsh onlin class
1745,1745,trueee webinar onlin class hahahhaha
1746,1746,suddenli onlin class
1747,1747,congratul suyen ann horlanda onlin class batch pass ascpi exam enrol ascpi amt dohad onlin review class set competit
1748,1748,onlin class dine eat onlin class hahahaha
1749,1749,saturday onlin class plan hendrex cdo anim beg mom
1750,1750,difficulti onlin class sleep wait link
1751,1751,load amp neighbor' wifi brother' onlin class queenfam
1752,1752,congratul
1753,1753,class time period pain onlin class
1754,1754,hey look onlin class tweet tweet haha
1755,1755,hear onlin class
1756,1756,pmp review onlin class januari februari amnn
1757,1757,clarifi understand basher onlin class romantic onlin class belong doubt abil onlin doubt laud
1758,1758,morn report lost power suppli locat maharlika taguig citi repair power suppli restor child onlin class
1759,1759,onlin class school
1760,1760,onlin class allerg rhiniti wors
1761,1761,batch mate
1762,1762,onlin class
1763,1763,peopl pass board exam nurs standard lower nurs increas hey poor patient nurs incompet onlin class increas
1764,1764,class onlin kdlex sweetheart rawraward
1765,1765,differ pace live onlin class term topic cover book
1766,1766,attend onlin class bardagulan read
1767,1767,maam neer product onlin class hahahaha
1768,1768,onlin meet constitut law class
1769,1769,maia class onlin cainta cathol colleg cainta calabarzon
1770,1770,struggl student teacher batch feel happi onlin class ojt
1771,1771,hey kiss recit onlin class huwhajakskssksk
1772,1772,bat onlin class sir sipagyarn
1773,1773,kaurat onlin class
1774,1774,friend told onlin class
1775,1775,ma'am onlin class tom base lindz' chika
1776,1776,suppos onlin class tugu
1777,1777,shesh jeep mygahd onlin class bep
1778,1778,onlin class tugu
1779,1779,rain hard class tomorrow chill rain onlin class
1780,1780,agre child attend onlin class imagin quick sky remind pay time connect
1781,1781,onlin class
1782,1782,sana nga true onlin class week
1783,1783,class prof lazi forget time rain huhu onlin class prin kmi mmya
1784,1784,hotel onlin class decemb morn class sunday forgiv lord
1785,1785,lost power yesterday minut onlin class wfh
1786,1786,acckkk wait bell onlin class mall donbel
1787,1787,print onlin class mldg time
1788,1788,wait chanc ppt report tonight onlin class told classmat pwede pang report mag travel pami uli arriv sleepi
1789,1789,time tom wake class onlin
1790,1790,mom onlin class week allow week
1791,1791,busi week hahaha tuesday prep onlin lectur wednesday wednesday onlin lectur feu laboratori class thu fri convent philspen makati weekend hospit duti fight
1792,1792,love onlin teach class setup eii corpor innov system strategi design program asian institut manag student graduat
1793,1793,doc wala nag onlin class huhu swear idk consent procedur legal guardian magsuit kaha day impress
1794,1794,dislik filipino time class onlin hour start class shit school
1795,1795,onlin class meet window game bar record meet dissoci
1796,1796,ftf hard studi onlin class
1797,1797,fun idea stream play game teach lesson psycholog stream onlin class
1798,1798,onlin class lose shit
1799,1799,onlin class
1800,1800,onlin class
1801,1801,onlin class mode muna
1802,1802,signal total discomfort onlin class cut morn arggghhh vibe
1803,1803,true sleep onlin class tire
1804,1804,delici hot onlin class rizal
1805,1805,answer girl onlin class
1806,1806,multipl receiv respons internet connect moment onlin classwfh set
1807,1807,readi tabl onlin class week
1808,1808,duti onlin class duti onlin class revolv
1809,1809,break onlin class tomorrow
1810,1810,beauti sister kai pubmat king busi inclass onlin class time mokpoodtrip kokoy rmph
1811,1811,drove tampakan gensan fathersu onlin class
1812,1812,escap onlin class
1813,1813,love attorney tulalian rare recit class nyt submit email stanc topic bait allow onlin onlin bless
1814,1814,review god onlin class matik kodigo
1815,1815,remedi onlin class yawn bore
1816,1816,crazi onlin class morn focus laptop class shutangina
1817,1817,stream gtgtgtgtgt onlin class midnightstaylorswift
1818,1818,luh haha onlin class haha
1819,1819,pandem bad onlin class pandem life control time realiz
1820,1820,onlin class
1821,1821,reduc screen time onlin class hahaahahaha
1822,1822,fortun allow onlin class tomorrow
1823,1823,louder bless privileg intellig cope onlin class comfort space
1824,1824,onlin class
1825,1825,yawq attend onlin class huhu
1826,1826,review onlin class hahaha
1827,1827,hope onlin class tomorrow
1828,1828,concert onlin class
1829,1829,stress inconveni caus son hybrid learn addit load attend onlin class
1830,1830,sister phone onlin class huh
1831,1831,ojt onlin class bird
1832,1832,late onlin class rememb sir come
1833,1833,ride yife studio morn class bfast onlin meet jabe bikethru squall kudo lgu instal bike ramp pedestrian walkway town bikecommut activetransport
1834,1834,breakfast wake onlin class
1835,1835,onlin class airport panick quiz manila realiti
1836,1836,lez delight dilat dilatra bit even onlin class
1837,1837,depart meet onlin class
1838,1838,headach night focus laptop onlin class subject mathemat statist recit
1839,1839,hey onlin class sleepi
1840,1840,choos boy reap hostil hatr peopl embolden onlin barda silenc basher disarm class kind choos moral road
1841,1841,onlin class madammm
1842,1842,onlin class huhuhu final enjoy day think
1843,1843,class present onlin poll revis grade format ukay hop costum
1844,1844,daddi hahahaha onlin class cam suddenli machet tummi kiss head hahahahahaha cutesi
1845,1845,shet onlin class tomorrow nice drink
1846,1846,onlin class beg lab
1847,1847,manila onlin class data
1848,1848,prefer onlin class learn lot
1849,1849,hard motiv teach onlin class
1850,1850,hope facetofac class saturday hope morn session onlin class smx
1851,1851,bad book tomorrow onlin class hahaa
1852,1852,bring onlin class
1853,1853,pist mane onlin class week nag
1854,1854,aunt angri parent lot money cousin jealou size pocket pocket onlin class teh
1855,1855,onlin class hate oral recit
1856,1856,che mamipi deng panangka reason onlin class attract korean lareng sir
1857,1857,morn complain pain haha onlin class
1858,1858,onlin class certif
1859,1859,onlin class span liter learn
1860,1860,wala naku ganahi ane onlin class haysst
1861,1861,pimp onlin class mask
1862,1862,discuss class onlin notepad whiteboard write accident minim app homescreen ipad wallpap fortun return panic
1863,1863,onlin class ulet
1864,1864,class upd class huhu hard understand lesson onlin
1865,1865,day onlin class
1866,1866,wait onlin class
1867,1867,feel onlin class ftf ftf exam prelim nervou feel
1868,1868,happi subscrib mommi onimor video watch eldest son phone broken onlin class niakeep safe godbless
1869,1869,ftf bet wear uniform onlin class ksksskkskaksk kingina
1870,1870,onlin class week rest hahaha
1871,1871,fun onlin class galan
1872,1872,sleep onlin class
1873,1873,readi delet tweet result onlin class
1874,1874,tire day ahahahaha healthi onlin class last hour straight
1875,1875,boracay vacat onlin class violat rule attend class qualiti perf chang wore bikini offcam
1876,1876,activit elm onlin class annoy
1877,1877,hope receiv gift hahafor onlin class document edit task
1878,1878,miss donbel bwhahaha eat mcdo ule onlin class donbel mcdonald
1879,1879,ane itey school requir uniform monday onlin class awar student clue expens tuition misc bag classroom save yarn
1880,1880,class onlin class sheeeshhh hassl
1881,1881,onlin class
1882,1882,damn onlin class hahahaha
1883,1883,meet mountain onlin class hahahha
1884,1884,bet onlin class straight class
1885,1885,lamiggg puta onlin class
1886,1886,onlin class hahahaha
1887,1887,onlin class student
1888,1888,die envi dlsu student walk hug friend class onlin class csb
1889,1889,onlin class hangov hehe
1890,1890,onlin class
1891,1891,ressi suddenli sang omsim barabidam omsim barabidam chuchu onlin class prof teach record video hahahahahaha
1892,1892,hey particip onlin class answer
1893,1893,wifi load onlin class
1894,1894,onlin class frustrat class nut
1895,1895,live manila juli allow onlin class allow school monday sunday haha
1896,1896,wow pray onlin class cost hahahaha pray
1897,1897,day onlin class
1898,1898,onlin class week
1899,1899,cri math hour onlin class eye pain shut
1900,1900,onlin class exam ftf shutaaa think traffic lazi school
1901,1901,day fair onlin class van heard class tuesday waaahhh ngl day unibersidad pilipina
1902,1902,feel tire onlin class sjheueuddbheeusbw
1903,1903,hope onlin class call
1904,1904,classmat mad onlin class day met school pay attent thingzzz
1905,1905,sched sem busiest pandem hear complain pray school shift onlin class class regain passion teach teach retir
1906,1906,walk tire hungri lack sleep sweat lot jeep rain hungri lot onlin class studi tire drain everyday love
1907,1907,landlin internet teenag jusmio' onlin class fast team' repli action
1908,1908,center stage camera ipad fun onlin class hahahahahaha bad
1909,1909,class onlin hope prof util hour
1910,1910,hahahaha shame onlin class cassi share classmat
1911,1911,samsung tab mall price palang sya perfect onlin class charger black cover spec
1912,1912,hard onlin class stabl connect
1913,1913,lunc onlin class
1914,1914,onlin class
1915,1915,ftf award deserv haha studi onlin class satisfi studi cram hay haha
1916,1916,watch niec onlin class mom classmat tita angel beauti beauti love
1917,1917,hard attend onlin class huhuhu
1918,1918,onlin class sleepi
1919,1919,onlin class lack skill follow disciplin
1920,1920,onlin class hahaha
1921,1921,onlin class
1922,1922,hahahaha slept onlin class hahahaha sowwiii
1923,1923,class onlin class purpos
1924,1924,teacher onlin class hahahahahahahaha
1925,1925,realiz spent ftf class audac onlin
1926,1926,class onlin class
1927,1927,care onlin class week goodluck carrier tomorrow
1928,1928,student hybrid set burn hair onlin class travel subject hahahahaha neljam del rosario
1929,1929,hard gala onlin class bitch haha
1930,1930,lupi onlin class professor announc
1931,1931,wfh care care mom onlin class teach class wake day worth
1932,1932,trip manila week onlin class hehe
1933,1933,traffic onlin class huhu
1934,1934,onlin class aning zameco
1935,1935,cough huhu onlin class laptop hahaha
1936,1936,enter onlin class unabl attend
1937,1937,product onlin class shi video
1938,1938,time studi tabl onlin class studi bed hahaha
1939,1939,tire onlin class hahahahaha
1940,1940,manila onlin class gimmick
1941,1941,sister camil hope notic onlin class
1942,1942,sister heart cell phone onlin class hope notic
1943,1943,onlin class saturday teacherofinstagram teachersofig teachersfollowteach teachertrib alsteach alslif alsteachersgo santa rosa laguna
1944,1944,bought onlin class onlin game told hahahahahaahaha
1945,1945,onlin class speech therapi idlip muna wait matt malolo matt therapi center
1946,1946,day onlin class stress
1947,1947,onlin class ftf mom dad break mental health yipey
1948,1948,onlin modular class rid anxieti
1949,1949,cri onlin class
1950,1950,onlin class
1951,1951,happi day onlin class chz
1952,1952,readi onlin class
1953,1953,stress prof stress hahahaha onlin class hahhahaha
1954,1954,forda ferson loss review write onlin class time
1955,1955,onlin class
1956,1956,day onlin class tomorrow email process messi unorgan huhuhu pup' process bit tediou wors ucc
1957,1957,hahhahaha rememb week lesson board drew town game includ load week onlin class
1958,1958,realiz wast opportun onlin class
1959,1959,time encount winona' onlin class fortun week mess lol dizzi
1960,1960,kayang exam class exam esp onlin retool time limit amp correct answer synthesi learn class
1961,1961,onlin class school haha putek san classroom hahahaha
1962,1962,onlin class write perma attend sheet liter
1963,1963,nah onlin class fuck
1964,1964,suppos nois onlin class
1965,1965,roller coaster ride week nuel recept onlin class haaay god friday
1966,1966,handl onlin class boost confid
1967,1967,tomorrow friday walay onlin class kuya kdrama haha episod atti woo
1968,1968,stress onlin class earlier
1969,1969,check onlin class
