,index,Processed Tweets
510,510,time cri onlin class hahahah
511,511,day onlin class
512,512,attend webinar earlier glp absorb kalerk peopl onlin class
513,513,hope sem' onlin class crazi
514,514,school ipcrf decid watch kdrama attend onlin class realiz fell asleep webinar hahaha deserv nako maka graduat
515,515,tire listen onlin class
516,516,satsun onlin class tuew super adjust
517,517,hope onlin class earn money studi
518,518,onlin class
519,519,haiissst pay week report landlin internet connect data connect student onlin class
520,520,onlin class lazi teach master code motiv school
521,521,internet cabl heist capit guess month internet outageday week poor wfh worker onlin class student prompt investig imper
522,522,onlin class
523,523,stori onlin class hahahahaha
524,524,onlin class time nanni
525,525,understand understand ultim sleep onlin class understood
526,526,uninstal googl meet onlin class shit
527,527,onlin class august septemb gala
528,528,onlin discuss philippin elect happen wonder time talk graduat class prof monika schoop dank schön engag present marcosdutert leviathan
529,529,onlin class read ppt bad student learn
530,530,professor assign academ eas pup disappear student cellphon onlin class load week
531,531,selfi complet onlin class
532,532,month everyday break onlin class suddenli start cri fellow teacher staff school
533,533,sunday onlin class exam
534,534,onlin class muteunmut
535,535,hard onlin class hahahaha
536,536,onlin class dave class decid sell gingangang hahah neighbor bought teacher teacher sell looy profit day
537,537,adjust period onlin class joke
538,538,internet children' onlin class activ complaint technician reach custom complain talk
539,539,english grammar skill bad onlin class goodnight stupid
540,540,bought addtl monitor mech keyboard chang tamad upgrad motiv onlin class
541,541,onlin class basket ball life attend leav meet nood gswvsbo gocurri
542,542,onlin exam onlin danc class blast
543,543,set setup onlin class
544,544,dean lister onlin class hahaha
545,545,onlin class walk ma'am hrm meet
546,546,onlin class stress cousin' modul
547,547,student grade onlin class
548,548,onlin class time haha
549,549,hybrid unicorn hybrid class time onlin class
550,550,academ walkout onlin class bobo
551,551,mock teacher stupid pass onlin class solv equat doubt
552,552,brain onlin class liter
553,553,difficult pack onlin class cloth ecija
554,554,mapua msu iit onlin class
555,555,teacher onlin class respond chat
556,556,handl vacat onlin class time hahahaha
557,557,onlin class god
558,558,onlin class live cellphon haha
559,559,smell onlin class nanamn
560,560,unstabl internet connect real struggl onlin class
561,561,impati nuel onlin class session earlier particip willingli haaay
562,562,rant onlin class
563,563,train requir jud camera team team anim gestungo cheap onlin class
564,564,stress onlin class earlier
565,565,onlin class
566,566,bioinfo difficult prof' onlin class fort hard understand time mess
567,567,onlin class
568,568,vibe kay leni background onlin class
569,569,cpu onlin class damag cpu repair repair repair bro check cpu understand
570,570,choos onlin class choos corni whahhaha
571,571,enjoy morn yoga class onlin support wear pink flow power vinyasa tomorrow april zoom class regist pinkyogathursday yoga
572,572,hahahaha jud mhb niuli rajud onlin class bahala nang ftf hahahahahahahahahahahahahaha
573,573,kingina onlin class properli song campaign haeoo
574,574,bad harder student hahah question googl read modul answer confus haha choos ftf easier onlin class studi
575,575,onlin class grind
576,576,hard onlin class haha fall asleep class
577,577,hassl disabl children' account onlin class
578,578,devil tell watch live onlin class hahahahahahah
579,579,onlin class hahahahahahahahah
580,580,saturday woke attend onlin class gym saturday
581,581,onlin class late
582,582,bongbong win school philippin onlin class expens
583,583,finish onlin english class chines korean student tire rest bit cebu lami ikaon hotdog egg milk gigutom
584,584,onlin class modal
585,585,onlin class avoid mess write instruct
586,586,hear laugh loudli minut downstair check hear meet
587,587,sleep netflix hope wake tomorrow onlin class pamor
588,588,kid busi onlin class daddi aquamik iwearsprinto maninisidatmanginginom magicmik artistcirl camp netanya
589,589,magshi shift hate onlin class
590,590,wala naman internet connect onlin class attend
591,591,grade improv amp thank semest struggl lot studi onlin class huhu classmat help surviv semest
592,592,nephew spiderman mile moral suit wear onlin class spiderman spidervers favorit spiderman movi
593,593,morn tutor afternoon onlin class grade
594,594,stupid onlin class complain onlin class brain foot pakyu
595,595,class onlin
596,596,sleep onlin class nmn
597,597,mundo perman involv focu colleg life onlin class
598,598,ched commission hous nervou onlin class student
599,599,light head pki bili onlin class sleep hour
600,600,stand onlin class periodt
601,601,sir happi happi birthdaythank happi stress onlin class hope fulfil request
602,602,veb onlin class ulit
603,603,readi onlin class lol
604,604,recycl pictur happi birthday favorit onlin shop buddi classmat love mhie hope class huhu mwa
605,605,jusqqq brain bleed onlin class hahahah
606,606,onlin class
607,607,onlin class hahahahaha
608,608,time tire onlin class
609,609,god bless student phone onlin class
610,610,sleep rememb sleep mad day sit onlin class
611,611,pldt internet son' onlin class
612,612,afford naman price tix deserv know acad onlin class
613,613,woyyy maam sing onlin class sir jasp helppp
614,614,sir sen hibiscu tagalog happen hero answer gumamela suddenli peso gcash send hahahaha onlin class periodt solac
615,615,heard bf' brother' onlin class teacher opinion student bbm presid teacher student bbm implement martial law teacher hahahahahahahahahahahahahahahahahahahaha
616,616,choos class onlin class choos hihi
617,617,proper onlin class play court haha
618,618,onlin class lagum hehe stand
619,619,laugh onlin class bought dog cage ma'am christian travel
620,620,accept class attend onlin class hahahahahahahahahahaha
621,621,boracay huehu hous week onlin class lyf sea lyfer hahaha bring laptop hngng
622,622,day bit product onlin class quiz assign
623,623,complet class week cancel haha uyay onlin class
624,624,onlin class liter boundari addit resourc limit overlook view unimport student' learn recreat drink tomorrow
625,625,hope school student readi uniform hard cope onlin class start journey colleg student
626,626,class ma'am marvi' onlin class hassl schedul ma'am favor haha favorit advis
627,627,laugh onlin class
628,628,mom life teenag morn fight cam onlin class school email
629,629,feel spoon-feed classmat onlin class difficult
630,630,bbm student absent onlin class score hahaha
631,631,picnic volleybal camp grassland onlin class feb life
632,632,onlin class care vacat
633,633,repli time appli earlier webinar onlin class opportun lord
634,634,nice inlov song song love mom dad madoka love charact remind draw niec messag middl onlin class
635,635,kid ken hahahha onlin class
636,636,onlin class tomorrow morn onlin class girl iloveyoual muahmuah
637,637,plan deactiv social medium account tranquil life realiz onlin class
638,638,sauna fruit pick onlin class hahahahahahaha hay
639,639,onlin class
640,640,multitask onlin class twitter hshsh
641,641,onlin class
642,642,plan modular tire onlin class ahhh shet bad luck hahahahahahahha
643,643,ftf nervou onlin class yawæ
644,644,convo nephew tito switch muna phone kasi onlin class kasi iphon lang samsung week lang phone lang iphon speechless
645,645,modul wtf usa ray onlin class
646,646,log onlin class appear vid check audiosupport
647,647,bday mom sister clan onlin class cam
648,648,happi morn monday onlin class meet naman
649,649,damn onlin ballet class space frustrat argh lost studio
650,650,onlin class tomm gagsi
651,651,halaaa oyyy wear uniform time onlin class
652,652,onlin class travel
653,653,onlin scienc class observ mam redella vista mam lizbeth martinez amp class congrat fbm depe francisco benitez memori school
654,654,onlin class tomorrow
655,655,processor handl multitask complet onlin class frustrat
656,656,onlin requir laptop desktop phone attend class huhuhu
657,657,philippin scienc onlin class
658,658,onlin class plastic hahahahaha
659,659,onlin class season
660,660,onlin class tuesday present
661,661,goodmorn breakfast onlin class heap school deadlin night hehe
662,662,valentin valentin onlin class hey hahahahahahahaha chz
663,663,time bad luck onlin class lord plan
664,664,tip focu guid onlin class care twin dual custom
665,665,particip onlin class log
666,666,monday flag ceremoni faculti meet tuesday school duti printer purchas wednesday onlin class supervis modular learner thursday leap print friday leap sort lesson record output check chapter academ health break
667,667,magssocil medium detox rememb onlin class shovel
668,668,son onlin class
669,669,boghsss onlin class legit link hahahaha
670,670,gosh hard studi onlin class bhe bhe stab cock
671,671,onlin class boy mom babi luca read play hahahahahahaha
672,672,bought ootd excit cloth bought onlin class
673,673,time slept onlin class
674,674,aww gac onlin class kmo
675,675,hard mode data onlin class
676,676,onlin class delici
677,677,nephew sleep onlin class
678,678,tire onlin class jusq
679,679,onlin class mcb anyareh
680,680,pwd mom nephew onlin class sister brave life town leni lift lenikiko leniforpresid tomorrow pink
681,681,tour guid hahaha onlin class fill answer
682,682,feel colleg learn onlin class
683,683,excit cap nervou duti onlin class enggk
684,684,teacher est admin fun onlin class night bingo enjoy lot
685,685,onlin class allow activ onlin lol
686,686,sleep onlin class decid sleep tomorrow
687,687,onlin class start electr farm wifi imagin joshua jolea jami edwin wifi pray lord listen
688,688,soc med break tempt onlin class
689,689,withhold salari financi support onlin class hahahaha
690,690,manila onlin class
691,691,sir hope choos onlin class
692,692,onlin class engag
693,693,decid chose onlin class know kay nibalhin nalang sab onlin hahah labyu girl
694,694,hang onlin class
695,695,onlin class
696,696,onlin class laptop
697,697,onlin class join onlin mass person lot angri deadli question
698,698,onlin class hurriedli laptop
699,699,danc onlin class
700,700,onlin class pasmo
701,701,pandem happen care mental health onlin class
702,702,hope financi aid grant coursera onlin class
703,703,weh onlin class
704,704,onlin class tvt
705,705,hope allow onlin class
706,706,day hahahah onlin class monday
707,707,listen nephew onlin class math subject eng follow formula equat
708,708,sister paid internet suddenli cut
709,709,onlin class modul hard poor
710,710,hous kitchen connect wifi target laptop onlin class lord
711,711,onlin class game
712,712,shaki onlin class
713,713,onlin class antineg lamp proven lamp useless
714,714,onlin class
715,715,stay sleep onlin class
716,716,sem onlin class pist yawa lits anim
717,717,onlin class
718,718,laklak wine onlin class
719,719,woke shower onlin class
720,720,wazzup alien angel late wahahaha woke late class onlin kokoy marspamor funfriday
721,721,read onlin class
722,722,nice onlin class
723,723,onlin class
724,724,esp cours lack hand experi lectur modul fool attend onlin class compli requir
725,725,student onlin class tomorrow googl classroom
726,726,skin onlin class
727,727,onlin class space hahah
728,728,absent onlin class tax evas hahahahaha disqualifybbm disqualifymarco
729,729,class stop covid transmit onlin
730,730,invest onlin class
731,731,onlin class guidanc
732,732,tulog movi seri vape kain onlin class repeat sem pla ramdam taena mag learn
733,733,time sleep onlin class straight duti mom
734,734,polish tiktok onlin class
735,735,pandem onlin class studi friend cellphon hand wake close eye morn
736,736,fight onlin class sore throat
737,737,mama student lead prayer onlin class grade child lord hope
738,738,putangina bat class thursday onlin scare
739,739,resolut hard studi learn onlin class
740,740,readi onlin class haha
741,741,jusko tuition onlin class
742,742,onlin class bitch
743,743,hope entranc onlin class extend happen
744,744,luxuri file loa tbf prof lang tho record yun lang onlin class tax
745,745,gage lost signal onlin class gage
746,746,stay safe covid god onlin class queen care
747,747,day onlin class
748,748,onlin class prayer sweet ear heart
749,749,friend particip onlin class modul
750,750,onlin class topic
751,751,sale month samsung lite tab origin unusu charger worth case temper glass smooth damag hidden issu brand onlin class game loc cruz pasaymalibay nagagamit detail
752,752,time hard tomorrow' onlin class
753,753,account temporarili unavail violat twitter medium polici learn
754,754,comeback fun onlin class
755,755,tbh health onlin class sick stay safe love lot xoxo
756,756,advic school come onlin class feel rest forc time health panic stay safe
757,757,onlin class practic understand
758,758,onlin class pictur
759,759,mom happi cumlaud difficult onlin class signal
760,760,teacher consider onlin class difficult
761,761,report activ reach piec paper write scan piec paper wrote express mind onlin classjob pressur
762,762,nauruugto dae iko fall onlin class meooow hahahaha
763,763,day zombi apocalyps onlin class edit
764,764,drunk onlin class hahahahahaha
765,765,ali onlin class
766,766,onlin class mother
767,767,onlin class
768,768,start dream phone alarm watch onlin class
769,769,onlin class
770,770,onlin class lazi studi hard
771,771,onlin class guy
772,772,forgot onlin class
773,773,tire onlin class hayup gwyneth chua pindehors
774,774,smell onlin class season hope
775,775,hey onlin class readi
776,776,congratul beatric isabel onlin class batch pass ascpi exam enrol ascpi amt dohad onlin review class set competit
777,777,congratul maria loreina cruz onlin class batch pass ascpi exam enrol ascpi amt dohad onlin review class set competit
778,778,trial class decemb eager embark french adventur stay onlin afm book seat dec pmpm level beginn durat hour price php onlin afmtrial
779,779,hey hotspot laptop onlin class money onlin ftf setup
780,780,sleepi nap onlin class tomorrow
781,781,onlin class tesda' food start
782,782,crux onlin class
783,783,onlin class hahahahaha
784,784,earthquak onsit class suspend class onlin class continu lectur
785,785,car attend onlin class particip swim
786,786,congratul
787,787,congratul fight
788,788,congratul
789,789,congratul
790,790,congratul
791,791,congratul
792,792,congratul
793,793,congratul
794,794,congratul
795,795,
796,796,motiv licens
797,797,dzaee giaatyy hahahahahaha set alarm onlin class sleep o'clock hahahhahahahah time meet hahahhahahahahaha time eye meet start hahahahahahahahahahahahahahahahah
798,798,zombi mode onlin class
799,799,frustrat onlin class internet bug
800,800,hour connect onlin class attend class absent night plan
801,801,congratul czarina macasaquit onlin class batch pass ascpi exam enrol ascpi amt dohad onlin review class set competit
802,802,professor attend complet onlin class annoy
803,803,onlin class
804,804,onlin class overtim sleepi
805,805,activ class hour onlin class
806,806,onlin meet crimin law class
807,807,day peopl onlin class struggl happi bond includ person struggl remov hard
808,808,wait onlin class week
809,809,lose motiv nice card achiev hard onlin class
810,810,bring onlin class
811,811,higa onlin class hahahahhahahaah
812,812,
813,813,term ust adopt combin onsit onlin class hour vice rector academ affair prof cheryl peralta told varsitarian
814,814,claim topnotch topnotch claim manifest pnle board passer topnotch cuti
815,815,day day tueskumon onlin class kumonphilippin
816,816,plm onlin class
817,817,nathan onlin class mama duti
818,818,yuppp onlin class start hahahahaha
819,819,function wellbut god understandingbcoz happen kid classw drove kuya fun school fairlittl girl stay tasksno class thur onlin fri sulk sad wait
820,820,yehey month onlin class laptop hahaha
821,821,onlin class nervou
822,822,onlin class discuss morn corpor meet feel
823,823,onlin class birthday hehe wabyu check charl kieron video tiktok
824,824,regularli govt agenc close interact lost class addit class onlin offer random kind
825,825,onlin class tomorrow
826,826,
827,827,sister onlin class
828,828,onlin class leader onlin class
829,829,surpris mare onlin class manag
830,830,onlin class expens answer
831,831,jctic offer intak learn japanes feel contact direct messag twitter whatsapp offer onlin class
832,832,onlin class narian admiss oflov janeshua darnaaftereffect
833,833,excit lost onlin class sheeettt
834,834,admit cut class shop shop internet cafe famou onlin game peso internet game hour share shop memori republicasia
835,835,haha talent break onlin class
836,836,wander time onlin class feel time
837,837,pmp review onlin class januari feb amnn
838,838,pretend game log onlin class
839,839,lot huuug
840,840,onlin class era week built
841,841,onlin class ramu todeh
842,842,break session lalo onlin class stress teacher student
843,843,play speaker onlin class play jeje song
844,844,monday class onlin bore
845,845,messag abt night shock talk dept student real reason delay suck peopl talk know true
846,846,hangov onlin class
847,847,onlin class school practic wors potangina
848,848,finmar onlin class
849,849,mental drain onlin class
850,850,lot gossip circl school student fail pnle roster passer file board exam quick gossip
851,851,tomorrow monday offic onlin class focu priorit
852,852,save onlin class
853,853,onlin class week
854,854,onlin class
855,855,onlin class
856,856,onlin class enjoy queue hahay
857,857,onlin class hay
858,858,lazi onlin class
859,859,onlin class suddenli exam
860,860,agenda tomorrow attend onlin servic attend review class overtim coz monday deadlin start wrap gift sobrang busi decemb
861,861,onlin class
862,862,tinee onlin class food
863,863,contribut prayer onlin class
864,864,reason lord' delay plan onlin class internet connect mbp
865,865,peopl read kinder niec onlin class elementari
866,866,leav onlin class life
867,867,onlin class deaf
868,868,bore yesterday subject day even class subject submit onlin
869,869,hurt read email sir task time attend onlin class manag time hope understand choic studi time understand
870,870,lectur network disconnect onlin class space
871,871,playgroup class sister onlin hihi enrol
872,872,hahxhshshsh onlin class rad glass
873,873,brother onlin class nois connect speaker listen prof judg heard provis rememb busi law subject
874,874,main reason mom onlin class
875,875,sister stop class onlin sem feel medicin
876,876,onlin class hahahaha
877,877,lot transact head teller class branch onlin touch pota
878,878,class onlin class week wild
879,879,induct session onlin class
880,880,woman talk time onlin class dem dey air
881,881,hire onlin class job offer
882,882,onlin mode class lazi teacher left unsupervis
883,883,onlin class
884,884,cousin laugh onlin class teacher report hahahhahahahaa
885,885,onlin class
886,886,listen onlin class gossip
887,887,brother hahah rememb onlin class brother school onlin class asleep
888,888,histori class onlin onli
889,889,reaction onlin class
890,890,frustrat phone onlin class colleg stupid phone attend class
891,891,onlin class worth
892,892,yesterday load onlin class report overtim
893,893,professor remedi law review decid class offici schedul hard start realiz wake
894,894,choos institut gain experi graduat onlin class choic choos
895,895,apaang ankga app joyrid book entertain theater novalich pass par onlin class ongo log properli listen teacher buzz noisi
896,896,onlin class connect time
897,897,topnotch pass rate onlin class opportun teach commun health nurs congratul
898,898,onlin class
899,899,hey friend highearn freelanc copywrit mentor onlin class start week kasama rin magig classmat send messag
900,900,agap tomorrow onlin class
901,901,feel lot overlap level design feng zhu specif onlin school fzd term teach class talent student gorgeou
902,902,read culinari school pari creation uncommon classpricey peopl popup store amp onlin wud expand south east asian countriesdito philippin macaron fave
903,903,heysss delet socm hshshsh onlin class
904,904,trueee webinar onlin class hahahhaha
905,905,suddenli onlin class
906,906,congratul suyen ann horlanda onlin class batch pass ascpi exam enrol ascpi amt dohad onlin review class set competit
907,907,onlin class dine eat onlin class hahahaha
908,908,saturday onlin class plan hendrex cdo anim beg mom
909,909,difficulti onlin class sleep wait link
910,910,load amp neighbor' wifi brother' onlin class queenfam
911,911,congratul
912,912,class time period pain onlin class
913,913,hey look onlin class tweet tweet haha
914,914,hear onlin class
915,915,pmp review onlin class januari februari amnn
916,916,clarifi understand basher onlin class romantic onlin class belong doubt abil onlin doubt laud
917,917,morn report lost power suppli locat maharlika taguig citi repair power suppli restor child onlin class
918,918,onlin class school
919,919,onlin class allerg rhiniti wors
920,920,batch mate
921,921,onlin class
922,922,peopl pass board exam nurs standard lower nurs increas hey poor patient nurs incompet onlin class increas
923,923,class onlin kdlex sweetheart rawraward
924,924,differ pace live onlin class term topic cover book
925,925,attend onlin class bardagulan read
926,926,maam neer product onlin class hahahaha
927,927,afternoon onlin class
928,928,onlin meet constitut law class
929,929,maia class onlin cainta cathol colleg cainta calabarzon
930,930,listen radio rio' pucha onlin class speaker
931,931,struggl student teacher batch feel happi onlin class ojt
932,932,bat onlin class sir sipagyarn
933,933,kaurat onlin class
934,934,friend told onlin class
935,935,ma'am onlin class tom base lindz' chika
936,936,suppos onlin class tugu
937,937,shesh jeep mygahd onlin class bep
938,938,onlin class tugu
939,939,agre child attend onlin class imagin quick sky remind pay time connect
940,940,sana nga true onlin class week
941,941,kasawa onlin class exam dayon semi final
942,942,class prof lazi forget time rain huhu onlin class prin kmi mmya
943,943,onlin class difficult honest
944,944,lost power yesterday minut onlin class wfh
945,945,acckkk wait bell onlin class mall donbel
946,946,presal onlin class
947,947,time tom wake class onlin
948,948,mom onlin class week allow week
949,949,busi week hahaha tuesday prep onlin lectur wednesday wednesday onlin lectur feu laboratori class thu fri convent philspen makati weekend hospit duti fight
950,950,food breaktim onlin class exchang nugget bright bologna yummi eira uhummm hambologna eira bright bbrightvc
951,951,ahh onlin class tomorrow
952,952,onlin class difficult difficult instructor graduat student
953,953,onlin class
954,954,class feel onlin class potek
955,955,thankkki babi sudden wander wallet readi hope onlin class time
956,956,love onlin teach class setup eii corpor innov system strategi design program asian institut manag student graduat
957,957,doc wala nag onlin class huhu swear idk consent procedur legal guardian magsuit kaha day impress
958,958,dislik filipino time class onlin hour start class shit school
959,959,stress onlin class disappear pictur hahahahahahaha labyu boy
960,960,hope onlin class regret
961,961,forda onlin class tom
962,962,onlin class mode muna
963,963,signal total discomfort onlin class cut morn arggghhh vibe
964,964,true sleep onlin class tire
965,965,delici hot onlin class rizal
966,966,understand water onlin class lord life borrow borrow
967,967,consist intermitt internet connect onlin class
968,968,birthday ghurl onlin class guest hahahahha
969,969,conduct class onlin class finish deliver client final makakatulog
970,970,break onlin class tomorrow
971,971,beat onlin class
972,972,onlin class
973,973,voic hoars attend onlin class
974,974,stuff onlin class remot sleep time nap sleep bath properli dress everyday judg hahahaha
975,975,escap onlin class
976,976,love attorney tulalian rare recit class nyt submit email stanc topic bait allow onlin onlin bless
977,977,review god onlin class matik kodigo
978,978,remedi onlin class yawn bore
979,979,crazi onlin class morn focus laptop class shutangina
980,980,stream gtgtgtgtgt onlin class midnightstaylorswift
981,981,luh haha onlin class haha
982,982,pandem bad onlin class pandem life control time realiz
983,983,onlin class
984,984,fortun allow onlin class tomorrow
985,985,feel onlin class
986,986,louder bless privileg intellig cope onlin class comfort space
987,987,servic morn connect kid onlin class hope solut pay advanc
988,988,worth wake watch onlin class hahahahaha
989,989,yawq attend onlin class huhu
990,990,review onlin class hahaha
991,991,hope onlin class tomorrow
992,992,ojt onlin class bird
993,993,huhu hope wake tomorrow busan excit watch onlin class
994,994,reprimand onlin school rush account talk buyer seller time onlin class feel blood pressur
995,995,dismiss even onlin class final vibe
996,996,lez delight dilat dilatra bit even onlin class
997,997,depart meet onlin class
998,998,headach night focus laptop onlin class subject mathemat statist recit
999,999,student onlin class
1000,1000,extend onlin class pleasee
1001,1001,happi sad senior happi reach onlin class doubt drop break
1002,1002,hey onlin class sleepi
