,index,Processed Tweets
1003,1003,choos boy reap hostil hatr peopl embolden onlin barda silenc basher disarm class kind choos moral road
1004,1004,onlin class huhuhu final enjoy day think
1005,1005,aaa onlin class monday left cauayan
1006,1006,onlin class addu extens sister tire fli plane
1007,1007,time bore sleepi onlin class haha
1008,1008,bring light time travel onlin class
1009,1009,class present onlin poll revis grade format ukay hop costum
1010,1010,report present onlin class naa pay duti
1011,1011,daddi hahahaha onlin class cam suddenli machet tummi kiss head hahahahahaha cutesi
1012,1012,shet onlin class tomorrow nice drink
1013,1013,onlin class care
1014,1014,onlin class beg lab
1015,1015,readi onlin class aja marki
1016,1016,peopl campu earlier onlin class haahahaha
1017,1017,manila onlin class data
1018,1018,onlin class haha malabon citi
1019,1019,onlin class haha
1020,1020,teacher' day graduat onlin class
1021,1021,hhaha brother onlin class play vovolleybal haha hope
1022,1022,prefer onlin class learn lot
1023,1023,hard motiv teach onlin class
1024,1024,hope facetofac class saturday hope morn session onlin class smx
1025,1025,bad book tomorrow onlin class hahaa
1026,1026,bring onlin class
1027,1027,pist mane onlin class week nag
1028,1028,aunt angri parent lot money cousin jealou size pocket pocket onlin class teh
1029,1029,ahh onlin class dukaer kykooo huhu
1030,1030,onlin class sea
1031,1031,watch boyfriend attend onlin class finish task drink coffe tapo kwentuhan magsleep haha ansaya
1032,1032,hard onlin class
1033,1033,onlin class nation museum hahahahahahahaha
1034,1034,happi fine magnebul cough
1035,1035,otw speech therapi onlin class grae malolo bulacan
1036,1036,che mamipi deng panangka reason onlin class attract korean lareng sir
1037,1037,morn complain pain haha onlin class
1038,1038,hey peopl connect wifi hahahahaha shut slow onlin class
1039,1039,laptop laptop slow healthi onlin class
1040,1040,stay awak class hahaha lazi drive hahaha onlin class
1041,1041,school school sat onlin class tomorrow huhu
1042,1042,onlin class suck
1043,1043,messeng classmat video video messag hahahahahahhahahahahhaha advis onlin class grade teacher eva octob music diamond rihanna
1044,1044,class walkout bangthedoor karon nga onlin classx ning igo close tab
1045,1045,onlin class certif
1046,1046,onlin class forda week hahahaha pick
1047,1047,onlin class span liter learn
1048,1048,asynchron mean class onlin offlin synchron class happen onlin
1049,1049,onlin class start goodby virtual teamcidqo lateupload whenindakak batangdapitanon dakak park beach resort
1050,1050,discuss class onlin notepad whiteboard write accident minim app homescreen ipad wallpap fortun return panic
1051,1051,onlin class ulet
1052,1052,class upd class huhu hard understand lesson onlin
1053,1053,accept onlin class
1054,1054,bring laptop class manila onlin class cool
1055,1055,sleep onlin class tomorrow haha
1056,1056,chore krok kdrama amp afternoon delight krok even onlin class krok dinner croc prayer croc studi quiz
1057,1057,chore kdrama afternoon delight head even onlin class
1058,1058,chapagetti hot latt afternoon delight even onlin class
1059,1059,person onlin class ampota
1060,1060,tear semest onlin class putangina
1061,1061,wtf onlin class putangina
1062,1062,onlin class dine birthday hahahahaha
1063,1063,rotten slow servic son onlin class properli day pldtbulok
1064,1064,day onlin class
1065,1065,brain drain exam onlin class hahahahahahahaha
1066,1066,laundri onlin class heavi rain
1067,1067,die wait onlin class finish
1068,1068,niec request bento lunch box onlin class ahahahaha
1069,1069,wait onlin class
1070,1070,happi subscrib mommi onimor video watch eldest son phone broken onlin class niakeep safe godbless
1071,1071,ftf bet wear uniform onlin class ksksskkskaksk kingina
1072,1072,onlin class week rest hahaha
1073,1073,fun onlin class galan
1074,1074,sleep onlin class
1075,1075,readi delet tweet result onlin class
1076,1076,tire day ahahahaha healthi onlin class last hour straight
1077,1077,activit elm onlin class annoy
1078,1078,hope receiv gift hahafor onlin class document edit task
1079,1079,miss donbel bwhahaha eat mcdo ule onlin class donbel mcdonald
1080,1080,gosh job onlin class huhuhu spot lgu taal kimmi hahahha
1081,1081,straight ampm tutor onlin class night req break sheshhh hahahajk
1082,1082,onlin class talk hahaha
1083,1083,hard time onlin class
1084,1084,day mainten converg interrupt class power block interrupt class clean event happen onlin class happen happen final paid rest oyasumi
1085,1085,tech support nephew onlin class taga bulong pag recit homeown associ meet
1086,1086,umay onlin class
1087,1087,lost focu onlin class elja
1088,1088,anuney son onlin class kalurk
1089,1089,law instructor conduct onlin class sound
1090,1090,class onlin class sheeeshhh hassl
1091,1091,onlin class
1092,1092,lamiggg puta onlin class
1093,1093,onlin class hahahaha
1094,1094,onlin class student
1095,1095,die envi dlsu student walk hug friend class onlin class csb
1096,1096,onlin class hangov hehe
1097,1097,cri math hour onlin class eye pain shut
1098,1098,onlin class exam ftf shutaaa think traffic lazi school
1099,1099,day fair onlin class van heard class tuesday waaahhh ngl day unibersidad pilipina
1100,1100,feel tire onlin class sjheueuddbheeusbw
1101,1101,hope onlin class call
1102,1102,classmat mad onlin class day met school pay attent thingzzz
1103,1103,landlin internet teenag jusmio' onlin class fast team' repli action
1104,1104,class onlin hope prof util hour
1105,1105,hahahaha shame onlin class cassi share classmat
1106,1106,samsung tab mall price palang sya perfect onlin class charger black cover spec
1107,1107,hard onlin class stabl connect
1108,1108,lunc onlin class
1109,1109,onlin class
1110,1110,ftf award deserv haha studi onlin class satisfi studi cram hay haha
1111,1111,hard attend onlin class huhuhu
1112,1112,onlin class sleepi
1113,1113,day return onlin class hahahahahah
1114,1114,kapoya onlin class ojt gyd ste
1115,1115,onlin class
1116,1116,condo onlin class
1117,1117,connect campu panooh onlin class nubaaah yupielbi
1118,1118,onlin class colleg valueseducationteacheryarn
1119,1119,shame teacher school onlin class
1120,1120,onlin class hahaha
1121,1121,onlin class
1122,1122,hahahaha slept onlin class hahahaha sowwiii
1123,1123,class onlin class purpos
1124,1124,teacher onlin class hahahahahahahaha
1125,1125,realiz spent ftf class audac onlin
1126,1126,class onlin class
1127,1127,care onlin class week goodluck carrier tomorrow
1128,1128,lupi onlin class professor announc
1129,1129,trip manila week onlin class hehe
1130,1130,onlin class aning zameco
1131,1131,cough huhu onlin class laptop hahaha
1132,1132,enter onlin class unabl attend
1133,1133,product onlin class shi video
1134,1134,time studi tabl onlin class studi bed hahaha
1135,1135,tire onlin class hahahahaha
1136,1136,manila onlin class gimmick
1137,1137,sister camil hope notic onlin class
1138,1138,sister heart cell phone onlin class hope notic
1139,1139,onlin class saturday teacherofinstagram teachersofig teachersfollowteach teachertrib alsteach alslif alsteachersgo santa rosa laguna
1140,1140,onlin class brew
1141,1141,bought onlin class onlin game told hahahahahaahaha
1142,1142,onlin class speech therapi idlip muna wait matt malolo matt therapi center
1143,1143,onlin class
1144,1144,day onlin class stress
1145,1145,onlin class ftf mom dad break mental health yipey
1146,1146,onlin modular class rid anxieti
1147,1147,cri onlin class
1148,1148,onlin class hahahaah
1149,1149,class sampler serf week trial parent unsur child readi hyflex learn combin day facetofac day onlin sign
1150,1150,onlin class
1151,1151,onlin class exam minimum min byah
1152,1152,happi day onlin class chz
1153,1153,readi onlin class
1154,1154,stress prof stress hahahaha onlin class hahhahaha
1155,1155,forda ferson loss review write onlin class time
1156,1156,onlin class
1157,1157,day onlin class tomorrow email process messi unorgan huhuhu pup' process bit tediou wors ucc
1158,1158,note toss handl komfil transfer teacher time semestr onlin class start
1159,1159,realiz wast opportun onlin class
1160,1160,possess onlin class
1161,1161,onlin class week
1162,1162,onlin class issu internet connect
1163,1163,time encount winona' onlin class fortun week mess lol dizzi
1164,1164,onlin class
1165,1165,onlin class neglect class
1166,1166,understand onlin class lazi
1167,1167,attend onlin class hahahahahah
1168,1168,onlin class ggca christianschool zgim south signal villag taguig citi
1169,1169,brother colleg onlin class everyday
1170,1170,kolsen eyjent guard onlin class real quick brgi bintog
1171,1171,gara naka onlin class day day day actual
1172,1172,hard onlin class time
1173,1173,recommend onlin class suspend class typhoon hope
1174,1174,friend onlin class rawr
1175,1175,friend asynchron onlin class teacher rain teambahay onlineclass firstdaycrazi firstdayofschool
1176,1176,bore onlin class
1177,1177,mom' chineck onlin class hahaha
1178,1178,onlin class storm
1179,1179,share school provid teacher laptop internet connect onlin class
1180,1180,stress onlin class hahaha
1181,1181,babi quiz babi time onlin class hahahahaha
1182,1182,onlin class
1183,1183,nalag sulod lage kog onlin class sunodhahshwjajahahaha
1184,1184,daw tong onlin class oyyy
1185,1185,day onlin class brgi bintog
1186,1186,onlin class
1187,1187,onlin class luck continu enter tomorrow peopl
1188,1188,liboga ani metc teacher onlin class liboga
1189,1189,onlin class sad ghad
1190,1190,onlin class effect valid mamsh
1191,1191,church onlin class haha huhu lord
1192,1192,onlin class stress stress monday
1193,1193,onlin class school haha putek san classroom hahahaha
1194,1194,roller coaster ride week nuel recept onlin class haaay god friday
1195,1195,handl onlin class boost confid
1196,1196,tomorrow friday walay onlin class kuya kdrama haha episod atti woo
1197,1197,stress onlin class earlier
1198,1198,rent class in-person lot hybrid onlin cours
1199,1199,check onlin class
1200,1200,tilid onlin class hahaha
1201,1201,hey nervou tom onlin class approv huhu
1202,1202,holi fuckin shit glad school sleep fuck prof enjoy haha hard onlin class catch teacher' punchlin laugh hahahaha damn comfort
1203,1203,girl onlin class
1204,1204,rehearsalltonlin class
1205,1205,cvsu onlin class
1206,1206,onlin class dissatisfact
1207,1207,shit onlin class sleepi
1208,1208,guy camera onlin class final vidja
1209,1209,hope onlin class
1210,1210,studentathleg ferson tra onlin class
1211,1211,wifi arw hang onlin class drink cold shake ktvroom livemus freeplaybeerpong waze tresto pub tresto bar baño
1212,1212,motiv idea onlin class week twice' week
1213,1213,shutaena onlin class
1214,1214,onlin class school
1215,1215,tire campu onlin class yesterday hahaha
1216,1216,onlin class
1217,1217,dorm embarrass week gala everyth messi embarrass onlin class tomorrow mood clean hahaha dirti unorgan
1218,1218,ftf onlin class haha
1219,1219,depend prof hyblend school week onlin class
1220,1220,yay class arrang min facenext onlin class
1221,1221,attend onlin class lie hhahahaha
1222,1222,sleepi close eye hahha fortun onlin class char
1223,1223,onlin class tomorrow wake
1224,1224,mess aah onlin class tomorrow amanda daw hay taranta
1225,1225,day onlin class activ special gosh
1226,1226,onlin class subject term virtual
1227,1227,sleep straight onlin class
1228,1228,sleepi morn onlin class
1229,1229,myyi monday class onlin yey happi
1230,1230,lot conflict onlin class school
1231,1231,onlin class start tomorrow sheesh
1232,1232,schedul broken saturday onlin class duti hahaha
1233,1233,classmat call hahaha listen onlin class
1234,1234,left gmeet asleep onlin class lucki discuss
1235,1235,materi onlin class tomorrow haha
1236,1236,arrog hhahahha onlin class colleg
1237,1237,hope onlin class class day
1238,1238,onlin class real
1239,1239,regular class colleg day onlin class extend day
1240,1240,onlin class kay
1241,1241,onlin class rin
1242,1242,onlin class hahhahaha
1243,1243,wawit term jusq onlin class hay
1244,1244,onlin class straight ketkai attend assembl chemco insigida kadawat yay chemco
1245,1245,class onlin experi
1246,1246,embarrass student pass entir class haha onlin platform recognit
1247,1247,haha onlin class crazi bwahahaha month bwahaha
1248,1248,hook hook hook onlin class babi
1249,1249,onlin class bet
1250,1250,fairview honor facetofac commenc speaker onlin graduat ceremoni congratul class aliv
1251,1251,pain told useless stupid graduat know lack sleep activ time endur hunger budget allow
1252,1252,graduat stupid cell phone night morn onlin class
1253,1253,onlin class alfonso
1254,1254,sleepi onlin class shutaca
1255,1255,mood onlin class feel fell asleep
1256,1256,onlin class haircut time hahaha
1257,1257,kind resid intern east ave asham doc dubiou knowledg skill onlin class
1258,1258,stay onlin class fun wait entranc volleybal court blame lot
1259,1259,onlin class hahahahahaha skwela hahaha
1260,1260,caught onlin class magna cum laud hahahah graduat magna magna jay stage hahahaha
1261,1261,latin honor smart onlin class hahahaha maximum hahaha deserv award congratul graduat batch
1262,1262,time cri onlin class hahahah
1263,1263,onlin class
1264,1264,haiissst pay week report landlin internet connect data connect student onlin class
1265,1265,life drop mareng jema queen falcon mareng momo hahaha leav offic onlin class cancel
1266,1266,hard onlin class rain feel signal
1267,1267,dentistri easi onlin class pay caught
1268,1268,honor grade honor grade grade drop sem onlin class broken grade fine grade averag transfer umai
1269,1269,internet cabl heist capit guess month internet outageday week poor wfh worker onlin class student prompt investig imper
1270,1270,cheap enrol onlin litsi class
1271,1271,dean agre onlin class semest
1272,1272,onlin class
1273,1273,stori onlin class hahahahaha
1274,1274,facetofac class enrol onlin class
1275,1275,answer assign onlin class bye
1276,1276,contribut onlin class cheer sir listen
1277,1277,brooo pmam duti tomorrow fuccin nervou haha child onlin class surpris duti
1278,1278,onlin class time nanni
1279,1279,understand understand ultim sleep onlin class understood
1280,1280,uninstal googl meet onlin class shit
1281,1281,onlin class august septemb gala
1282,1282,onlin discuss philippin elect happen wonder time talk graduat class prof monika schoop dank schön engag present marcosdutert leviathan
1283,1283,nectar era rememb imhow emot drain middl onlin class listen nectar album
1284,1284,professor assign academ eas pup disappear student cellphon onlin class load week
1285,1285,selfi complet onlin class
1286,1286,month everyday break onlin class suddenli start cri fellow teacher staff school
1287,1287,sunday onlin class exam
1288,1288,onlin class muteunmut
1289,1289,hard onlin class hahahaha
1290,1290,onlin class dave class decid sell gingangang hahah neighbor bought teacher teacher sell looy profit day
1291,1291,adjust period onlin class joke
1292,1292,internet children' onlin class activ complaint technician reach custom complain talk
1293,1293,onlin orient metro manila pride solidar statement attend lgbt rep virtual class paraleg studi energi juskoleeerdmag milo
1294,1294,english grammar skill bad onlin class goodnight stupid
1295,1295,onlin class onlin midterm final exam pass differ exam paper access onlin lol
1296,1296,onlin class basket ball life attend leav meet nood gswvsbo gocurri
1297,1297,sooner onlin class lol week onlin class admin understood happen batch base conting follow capabl
1298,1298,sleep friday child chanc miss onlin class mother wake late
1299,1299,onlin exam onlin danc class blast
1300,1300,set setup onlin class
1301,1301,dean lister onlin class hahaha
1302,1302,month onlin class onlin chismisan final final final
1303,1303,wait class sick onlin keme guess bibl
1304,1304,understand assign confus embarrass hate onlin class
1305,1305,epic happen onlin class forgot offcam stood boxer prof nake
1306,1306,learn onlin class colleg
1307,1307,play record onlin class correctli
1308,1308,onlin class
1309,1309,school onlin class bad
1310,1310,retak psycholog understand onlin class
1311,1311,onlin class haha
1312,1312,listen hay onlin class myayamvtrail
1313,1313,time check finish visual class time powerpoint nmn onlin class taena hybrid class hard
1314,1314,onlin class wonwonhahahah dudhsudhgdywgyd
1315,1315,onlin class hahahhaha
1316,1316,student grade onlin class
1317,1317,ay' uniform worst scc sad onlin class
1318,1318,experi class activ
1319,1319,psych major cope onlin class
1320,1320,onlin class
1321,1321,review review tomorrow' onlin class haha
1322,1322,onlin class
1323,1323,manifest acer swift loptop bekenemen onlin class nextatac planetac
1324,1324,afternoon internet week day internet connect onlin class delay servic tsk tsk tsk
1325,1325,slowli onlin class
1326,1326,shame ma'am class onlin class treasuri offic cashier hahhahah float beh
1327,1327,chiki onlin class today viryyoww embarrass internet connect wast
1328,1328,insert onlin class
1329,1329,cousin' teluk teatalk onlin class hahahaha
1330,1330,start studi thesi defens board plan review learn onlin class
1331,1331,crawl onlin class
1332,1332,aunt malou onlin onlin class aunt malou graduat aunti haha aunt malou time fast puchaaa hahahahaha aunti graduat useless hahahahahaha
1333,1333,fuco onlin class mind
1334,1334,nasa onlin class
1335,1335,activ develop improv nephew onlin class
1336,1336,day mba deadlin onlin class
1337,1337,onlin class
1338,1338,told class onlin class pnc citech quiet student concern happen happi vote mayor mel
1339,1339,normal acclamay onlin class tomorrow smart smart yanem hahahhaah
1340,1340,academ walkout onlin class bobo
1341,1341,mock teacher stupid pass onlin class solv equat doubt
1342,1342,brain onlin class liter
1343,1343,teacher onlin class respond chat
1344,1344,tbh love color pswlng aatend onlin classdjwk preciouslngpri mxjvng hey moot follow day
1345,1345,onlin class lazi wrong
1346,1346,leni critic spark repli base group' callout statement onlin class untru
1347,1347,handl vacat onlin class time hahahaha
1348,1348,onlin class god
1349,1349,onlin class live cellphon haha
1350,1350,smell onlin class nanamn
1351,1351,impati nuel onlin class session earlier particip willingli haaay
1352,1352,rant onlin class
1353,1353,onlin class
1354,1354,start week smileeyyy onlin class
1355,1355,group poor introvert onlin class whahahaha
1356,1356,sunni sunday citi data busi ongo onlin class
1357,1357,boy senior kinder surviv onlin class hide background tsinela pamatpat cittadini school
1358,1358,onlin class sleep sister jessa sleep
1359,1359,faculti staff bore onlin class conduct festiv move hahahahahaha
1360,1360,onlin class haha
1361,1361,perk onlin class messeng gmail gdrive gclassroom busi busog time huhu cookeri practic teacher nakakatakam hahahaha
1362,1362,onlin class galan
1363,1363,addict troop onlin class mind applic field
1364,1364,life updatebeen face laptop day huhu check student answer sheet encod grade ecr constant remind lack output onlin class huhu busi internship eye tire overus
1365,1365,class onlin class watch seri
1366,1366,hope onlin class doubt peopl drop onlin class
1367,1367,choos onlin class choos corni whahhaha
1368,1368,onlin class listen
1369,1369,rosh reach parent feel onlin class
1370,1370,onlin class bit swim happen
1371,1371,law school brutal onlin class move wed
1372,1372,day onlin class mare
1373,1373,review tomorrow onlin class master koto
1374,1374,late onlin class hey
1375,1375,onlin class fun day complet repres luzon visaya mindanao
1376,1376,hahahaha jud mhb niuli rajud onlin class bahala nang ftf hahahahahahahahahahahahahaha
1377,1377,filipino onlin class
1378,1378,kingina onlin class properli song campaign haeoo
1379,1379,bad harder student hahah question googl read modul answer confus haha choos ftf easier onlin class studi
1380,1380,good perfect tuition fee onlin class
1381,1381,puro onlin class week
1382,1382,send join onlin class hahaha
1383,1383,follow attend onlin class
1384,1384,mmovi marathon saturday attend onlin class
1385,1385,start class hard ace onlin class
1386,1386,hard onlin class haha fall asleep class
1387,1387,lot requir allow campu access bet onlin class lol
1388,1388,onlin class whaha
1389,1389,hassl disabl children' account onlin class
1390,1390,devil tell watch live onlin class hahahahahahah
1391,1391,onlin class hahahahahahahahah
1392,1392,bad birthday onlin class prof hahahaha charizz
1393,1393,onlin class onlin chikahan
1394,1394,onlin class hahahahahaha
1395,1395,cheat prevail nowaday kasi nga onlin setup claim confid unmut speak class prof someon smart true rel
1396,1396,ice coffe hapon onlin class tonight
1397,1397,hard balanc review resign monday nnpm pmpm onlin class tuesdaythursday ampm pmpm onlin class friday ampm ampm trivia saturday ampm trivia sunday weekli exam
1398,1398,tangina pldt repair afternoon pota onlin class hey bwct
1399,1399,surviv beach yesterday lol lil bro attend onlin class pico loro beach countri club
1400,1400,complain tire onlin class
1401,1401,readi trip hometown allacapan cagayan weekend hous hous campaign lenikiko fellow volunt bring book note onlin class worth ipanalonato
1402,1402,guinayangan quezon time refresh stresful exam onlin class
1403,1403,lol public speak onlin class anxieti bad fix
1404,1404,perk onlin class wear underwear class plhivdiari plhiv ptrpmd
1405,1405,difficult algebra semest dizzi promis attend onlin class sir explain hahaha sleep nytt yall
1406,1406,pasiglaban onlin class enthusiasm fight troop pasigforlenikiko
1407,1407,onlin classensayono
1408,1408,nephew spiderman mile moral suit wear onlin class spiderman spidervers favorit spiderman movi
1409,1409,onlin class hag
1410,1410,jungwon onlin class
1411,1411,strong onlin class time
1412,1412,shuta laptop play trick day constant updat laptop time onlin class shuta waaahhh
1413,1413,catch onlin class phone tablet cazaperegrineresort wifi remoteworkingmom nothin caza peregrin resort amp restaur
1414,1414,class onlin
1415,1415,giatad wako happi hahaha time protocol hehe onlin class
1416,1416,pass onlin class galileo hehezz
1417,1417,onlin class laguindingan airport laguindingan misami orient
1418,1418,onlin class tol hahaha joke hahaha hahaha
1419,1419,classmat school onlin min class kdppe perthsday
1420,1420,mundo perman involv focu colleg life onlin class
1421,1421,lazi onlin class
1422,1422,tabian gyapon onlin class
1423,1423,kid sir onlin classveri famili
1424,1424,choos onlin class
1425,1425,onlin class
1426,1426,ched commission hous nervou onlin class student
1427,1427,light head pki bili onlin class sleep hour
1428,1428,stand onlin class periodt
1429,1429,veb onlin class ulit
1430,1430,readi onlin class lol
1431,1431,onlin class
1432,1432,onlin class hahahahaha
1433,1433,time tire onlin class
1434,1434,sleep rememb sleep mad day sit onlin class
1435,1435,pldt internet son' onlin class
1436,1436,woyyy maam sing onlin class sir jasp helppp
1437,1437,onlin class swing
1438,1438,choos class onlin class choos hihi
1439,1439,laugh onlin class bought dog cage ma'am christian travel
1440,1440,accept class attend onlin class hahahahahahahahahahaha
1441,1441,day bit product onlin class quiz assign
1442,1442,onlin class liter boundari addit resourc limit overlook view unimport student' learn recreat drink tomorrow
1443,1443,hope school student readi uniform hard cope onlin class start journey colleg student
1444,1444,class ma'am marvi' onlin class hassl schedul ma'am favor haha favorit advis
1445,1445,bbm student absent onlin class score hahaha
1446,1446,picnic volleybal camp grassland onlin class feb life
1447,1447,onlin class care vacat
1448,1448,repli time appli earlier webinar onlin class opportun lord
1449,1449,nice inlov song song love mom dad madoka love charact remind draw niec messag middl onlin class
1450,1450,onlin class tomorrow morn onlin class girl iloveyoual muahmuah
1451,1451,plan deactiv social medium account tranquil life realiz onlin class
1452,1452,onlin class
1453,1453,multitask onlin class twitter hshsh
1454,1454,onlin class
1455,1455,plan modular tire onlin class ahhh shet bad luck hahahahahahahha
1456,1456,ftf nervou onlin class yawæ
1457,1457,convo nephew tito switch muna phone kasi onlin class kasi iphon lang samsung week lang phone lang iphon speechless
1458,1458,modul wtf usa ray onlin class
1459,1459,log onlin class appear vid check audiosupport
1460,1460,bday mom sister clan onlin class cam
1461,1461,happi morn monday onlin class meet naman
1462,1462,kitchen lab onlin class ren
1463,1463,realiti onlin class
1464,1464,reflect student hour onlin class day think assess time play onlin game mobil legend watch netflix surviv grade
1465,1465,onlin class haha option
1466,1466,finish req doubl hahaha umay ftof onlin class setup
1467,1467,slow phone matter delet memori hahahaha instal app onlin class
1468,1468,pick badli onlin class godbless
1469,1469,onlin class
1470,1470,offlin peac mind onlin class onlin updat subject
1471,1471,onlin class travel
1472,1472,onlin class tomorrow
1473,1473,onlin requir laptop desktop phone attend class huhuhu
1474,1474,onlin class plastic hahahahaha
1475,1475,onlin class season
1476,1476,onlin class tuesday present
1477,1477,particip onlin class log
1478,1478,wait wait break onlin class yawn sleep sweet action
1479,1479,onlin class float
1480,1480,game onlin review class hahaha appet charizz
