,index,Processed Tweets
0,0,congratul beatric isabel onlin class batch pass ascpi exam enrol ascpi amt dohad onlin review class set competit
1,1,congratul maria loreina cruz onlin class batch pass ascpi exam enrol ascpi amt dohad onlin review class set competit
2,2,trial class decemb eager embark french adventur stay onlin afm book seat dec pmpm level beginn durat hour price php onlin afmtrial
3,3,hey hotspot laptop onlin class money onlin ftf setup
4,4,sleepi nap onlin class tomorrow
5,5,onlin class tesda' food start
6,6,crux onlin class
7,7,onlin class hahahahaha
8,8,earthquak onsit class suspend class onlin class continu lectur
9,9,car attend onlin class particip swim
10,10,congratul
11,11,congratul fight
12,12,congratul
13,13,congratul
14,14,congratul
15,15,congratul
16,16,congratul
17,17,congratul
18,18,congratul
19,19,
20,20,motiv licens
21,21,dzaee giaatyy hahahahahaha set alarm onlin class sleep o'clock hahahhahahahah time meet hahahhahahahahaha time eye meet start hahahahahahahahahahahahahahahahah
22,22,zombi mode onlin class
23,23,frustrat onlin class internet bug
24,24,hour connect onlin class attend class absent night plan
25,25,congratul czarina macasaquit onlin class batch pass ascpi exam enrol ascpi amt dohad onlin review class set competit
26,26,professor attend complet onlin class annoy
27,27,onlin class
28,28,onlin class overtim sleepi
29,29,activ class hour onlin class
30,30,onlin meet crimin law class
31,31,day peopl onlin class struggl happi bond includ person struggl remov hard
32,32,wait onlin class week
33,33,lose motiv nice card achiev hard onlin class
34,34,bring onlin class
35,35,higa onlin class hahahahhahahaah
36,36,
37,37,term ust adopt combin onsit onlin class hour vice rector academ affair prof cheryl peralta told varsitarian
38,38,claim topnotch topnotch claim manifest pnle board passer topnotch cuti
39,39,day day tueskumon onlin class kumonphilippin
40,40,plm onlin class
41,41,nathan onlin class mama duti
42,42,yuppp onlin class start hahahahaha
43,43,function wellbut god understandingbcoz happen kid classw drove kuya fun school fairlittl girl stay tasksno class thur onlin fri sulk sad wait
44,44,yehey month onlin class laptop hahaha
45,45,onlin class nervou
46,46,onlin class discuss morn corpor meet feel
47,47,onlin class birthday hehe wabyu check charl kieron video tiktok
48,48,regularli govt agenc close interact lost class addit class onlin offer random kind
49,49,onlin class tomorrow
50,50,
51,51,sister onlin class
52,52,onlin class leader onlin class
53,53,surpris mare onlin class manag
54,54,onlin class expens answer
55,55,jctic offer intak learn japanes feel contact direct messag twitter whatsapp offer onlin class
56,56,onlin class narian admiss oflov janeshua darnaaftereffect
57,57,excit lost onlin class sheeettt
58,58,admit cut class shop shop internet cafe famou onlin game peso internet game hour share shop memori republicasia
59,59,haha talent break onlin class
60,60,wander time onlin class feel time
61,61,pmp review onlin class januari feb amnn
62,62,pretend game log onlin class
63,63,lot huuug
64,64,onlin class era week built
65,65,onlin class ramu todeh
66,66,break session lalo onlin class stress teacher student
67,67,play speaker onlin class play jeje song
68,68,monday class onlin bore
69,69,messag abt night shock talk dept student real reason delay suck peopl talk know true
70,70,hangov onlin class
71,71,onlin class school practic wors potangina
72,72,finmar onlin class
73,73,mental drain onlin class
74,74,lot gossip circl school student fail pnle roster passer file board exam quick gossip
75,75,tomorrow monday offic onlin class focu priorit
76,76,save onlin class
77,77,onlin class week
78,78,onlin class
79,79,onlin class
80,80,onlin class enjoy queue hahay
81,81,onlin class hay
82,82,lazi onlin class
83,83,onlin class suddenli exam
84,84,agenda tomorrow attend onlin servic attend review class overtim coz monday deadlin start wrap gift sobrang busi decemb
85,85,onlin class
86,86,tinee onlin class food
87,87,contribut prayer onlin class
88,88,reason lord' delay plan onlin class internet connect mbp
89,89,peopl read kinder niec onlin class elementari
90,90,leav onlin class life
91,91,onlin class deaf
92,92,bore yesterday subject day even class subject submit onlin
93,93,hurt read email sir task time attend onlin class manag time hope understand choic studi time understand
94,94,lectur network disconnect onlin class space
95,95,playgroup class sister onlin hihi enrol
96,96,hahxhshshsh onlin class rad glass
97,97,brother onlin class nois connect speaker listen prof judg heard provis rememb busi law subject
98,98,main reason mom onlin class
99,99,sister stop class onlin sem feel medicin
100,100,onlin class hahahaha
101,101,lot transact head teller class branch onlin touch pota
102,102,class onlin class week wild
103,103,induct session onlin class
104,104,woman talk time onlin class dem dey air
105,105,hire onlin class job offer
106,106,onlin mode class lazi teacher left unsupervis
107,107,onlin class
108,108,cousin laugh onlin class teacher report hahahhahahahaa
109,109,onlin class
110,110,listen onlin class gossip
111,111,brother hahah rememb onlin class brother school onlin class asleep
112,112,histori class onlin onli
113,113,reaction onlin class
114,114,frustrat phone onlin class colleg stupid phone attend class
115,115,onlin class worth
116,116,yesterday load onlin class report overtim
117,117,professor remedi law review decid class offici schedul hard start realiz wake
118,118,choos institut gain experi graduat onlin class choic choos
119,119,apaang ankga app joyrid book entertain theater novalich pass par onlin class ongo log properli listen teacher buzz noisi
120,120,onlin class connect time
121,121,topnotch pass rate onlin class opportun teach commun health nurs congratul
122,122,onlin class
123,123,hey friend highearn freelanc copywrit mentor onlin class start week kasama rin magig classmat send messag
124,124,agap tomorrow onlin class
125,125,feel lot overlap level design feng zhu specif onlin school fzd term teach class talent student gorgeou
126,126,read culinari school pari creation uncommon classpricey peopl popup store amp onlin wud expand south east asian countriesdito philippin macaron fave
127,127,heysss delet socm hshshsh onlin class
128,128,trueee webinar onlin class hahahhaha
129,129,suddenli onlin class
130,130,congratul suyen ann horlanda onlin class batch pass ascpi exam enrol ascpi amt dohad onlin review class set competit
131,131,onlin class dine eat onlin class hahahaha
132,132,saturday onlin class plan hendrex cdo anim beg mom
133,133,difficulti onlin class sleep wait link
134,134,load amp neighbor' wifi brother' onlin class queenfam
135,135,congratul
136,136,class time period pain onlin class
137,137,hey look onlin class tweet tweet haha
138,138,hear onlin class
139,139,pmp review onlin class januari februari amnn
140,140,clarifi understand basher onlin class romantic onlin class belong doubt abil onlin doubt laud
141,141,morn report lost power suppli locat maharlika taguig citi repair power suppli restor child onlin class
142,142,onlin class school
143,143,onlin class allerg rhiniti wors
144,144,batch mate
145,145,onlin class
146,146,peopl pass board exam nurs standard lower nurs increas hey poor patient nurs incompet onlin class increas
147,147,class onlin kdlex sweetheart rawraward
148,148,differ pace live onlin class term topic cover book
149,149,attend onlin class bardagulan read
150,150,maam neer product onlin class hahahaha
151,151,afternoon onlin class
152,152,jask practic cheerdanc onlin class tomorrow awit lod
153,153,onlin meet constitut law class
154,154,onlin class
155,155,hahahha pursuant ordin hahhaha charot allow onlin class eme
156,156,leter onlin class chismi
157,157,onlin korean languag class amp learn process memor alphabet amp learn handwritten cheatsheet 안녕핫ㅔ요 보라해
158,158,onlin class confus sign zoom simplifi lot enter meet
159,159,hey kiss recit onlin class huwhajakskssksk
160,160,kaurat onlin class
161,161,friend told onlin class
162,162,suppos onlin class tugu
163,163,onlin class tugu
164,164,rain hard class tomorrow chill rain onlin class
165,165,sana nga true onlin class week
166,166,class prof lazi forget time rain huhu onlin class prin kmi mmya
167,167,busi week hahaha tuesday prep onlin lectur wednesday wednesday onlin lectur feu laboratori class thu fri convent philspen makati weekend hospit duti fight
168,168,shoe onlin class zalora zalorabiggestfashionsal
169,169,struggl talaga magpres onlin class lang nasa biyah interfac hassl mic hay
170,170,onlin class watch tomorrow hahahah charizz donbel donbellexpepsi
171,171,onlin class meet window game bar record meet dissoci
172,172,ftf hard studi onlin class
173,173,fun idea stream play game teach lesson psycholog stream onlin class
174,174,onlin class lose shit
175,175,onlin class
176,176,stress onlin class disappear pictur hahahahahahaha labyu boy
177,177,onlin class start beastmodeon crossfit hieroglyph puerto princesa palawan
178,178,onlin class
179,179,hope onlin class regret
180,180,forda onlin class tom
181,181,onlin class mode muna
182,182,signal total discomfort onlin class cut morn arggghhh vibe
183,183,true sleep onlin class tire
184,184,favorit sim unli data day studi onlin class
185,185,answer onlin class person
186,186,answer girl onlin class
187,187,multipl receiv respons internet connect moment onlin classwfh set
188,188,understand water onlin class lord life borrow borrow
189,189,consist intermitt internet connect onlin class
190,190,onlin class tomorrow halloween parti wednesday thursday love lpu vivapirata
191,191,drove tampakan gensan fathersu onlin class
192,192,escap onlin class
193,193,love attorney tulalian rare recit class nyt submit email stanc topic bait allow onlin onlin bless
194,194,review god onlin class matik kodigo
195,195,remedi onlin class yawn bore
196,196,crazi onlin class morn focus laptop class shutangina
197,197,stream gtgtgtgtgt onlin class midnightstaylorswift
198,198,luh haha onlin class haha
199,199,pandem bad onlin class pandem life control time realiz
200,200,onlin class
201,201,fortun allow onlin class tomorrow
202,202,boogsh onlin class tomorrow hehe
203,203,onlin class fortun people' real behavior
204,204,concert onlin class
205,205,sister phone onlin class huh
206,206,sister start onlin class kid hahaha brother support question walk paper
207,207,drain onlin class idea time manag motiv finish
208,208,brother recit onlin class talk hahahahahaha
209,209,dismiss even onlin class final vibe
210,210,ride yife studio morn class bfast onlin meet jabe bikethru squall kudo lgu instal bike ramp pedestrian walkway town bikecommut activetransport
211,211,breakfast wake onlin class
212,212,onlin class airport panick quiz manila realiti
213,213,lez delight dilat dilatra bit even onlin class
214,214,depart meet onlin class
215,215,headach night focus laptop onlin class subject mathemat statist recit
216,216,student onlin class
217,217,extend onlin class pleasee
218,218,hey onlin class sleepi
219,219,choos boy reap hostil hatr peopl embolden onlin barda silenc basher disarm class kind choos moral road
220,220,bring light time travel onlin class
221,221,class present onlin poll revis grade format ukay hop costum
222,222,report present onlin class naa pay duti
223,223,daddi hahahaha onlin class cam suddenli machet tummi kiss head hahahahahaha cutesi
224,224,shet onlin class tomorrow nice drink
225,225,onlin class care
226,226,onlin class beg lab
227,227,readi onlin class aja marki
228,228,peopl campu earlier onlin class haahahaha
229,229,manila onlin class data
230,230,onlin class haha malabon citi
231,231,onlin class haha
232,232,teacher' day graduat onlin class
233,233,hhaha brother onlin class play vovolleybal haha hope
234,234,prefer onlin class learn lot
235,235,hard motiv teach onlin class
236,236,hope facetofac class saturday hope morn session onlin class smx
237,237,bad book tomorrow onlin class hahaa
238,238,bring onlin class
239,239,ahh onlin class dukaer kykooo huhu
240,240,onlin class sea
241,241,watch boyfriend attend onlin class finish task drink coffe tapo kwentuhan magsleep haha ansaya
242,242,hard onlin class
243,243,onlin class nation museum hahahahahahahaha
244,244,happi fine magnebul cough
245,245,otw speech therapi onlin class grae malolo bulacan
246,246,che mamipi deng panangka reason onlin class attract korean lareng sir
247,247,morn complain pain haha onlin class
248,248,hey peopl connect wifi hahahahaha shut slow onlin class
249,249,laptop laptop slow healthi onlin class
250,250,stay awak class hahaha lazi drive hahaha onlin class
251,251,school school sat onlin class tomorrow huhu
252,252,onlin class suck
253,253,messeng classmat video video messag hahahahahahhahahahahhaha advis onlin class grade teacher eva octob music diamond rihanna
254,254,class walkout bangthedoor karon nga onlin classx ning igo close tab
255,255,enter school onlin class heheh
256,256,onlin class certif
257,257,onlin inbetween school morn expect onlin class drivingcommut talamban conveni
258,258,asynchron mean class onlin offlin synchron class happen onlin
259,259,onlin class start goodby virtual teamcidqo lateupload whenindakak batangdapitanon dakak park beach resort
260,260,onlin class
261,261,bebe girl onlin class
262,262,matter close attitud hit post grade onlin class potacca
263,263,accept onlin class
264,264,bring laptop class manila onlin class cool
265,265,sleep onlin class tomorrow haha
266,266,onlin class tomorrow hahahaha
267,267,chore krok kdrama amp afternoon delight krok even onlin class krok dinner croc prayer croc studi quiz
268,268,chore kdrama afternoon delight head even onlin class
269,269,chapagetti hot latt afternoon delight even onlin class
270,270,person onlin class ampota
271,271,onlin class perfect
272,272,day tomorrow day properli child' onlin class pldtbulok
273,273,tear semest onlin class putangina
274,274,wtf onlin class putangina
275,275,onlin class dine birthday hahahahaha
276,276,friii onlin class
277,277,rotten slow servic son onlin class properli day pldtbulok
278,278,day onlin class
279,279,brain drain exam onlin class hahahahahahahaha
280,280,laundri onlin class heavi rain
281,281,die wait onlin class finish
282,282,niec request bento lunch box onlin class ahahahaha
283,283,onlin class kinder difficult
284,284,wait onlin class
285,285,feel onlin class ftf ftf exam prelim nervou feel
286,286,happi subscrib mommi onimor video watch eldest son phone broken onlin class niakeep safe godbless
287,287,ftf bet wear uniform onlin class ksksskkskaksk kingina
288,288,onlin class week rest hahaha
289,289,fun onlin class galan
290,290,sleep onlin class
291,291,readi delet tweet result onlin class
292,292,tire day ahahahaha healthi onlin class last hour straight
293,293,boracay vacat onlin class violat rule attend class qualiti perf chang wore bikini offcam
294,294,activit elm onlin class annoy
295,295,hope receiv gift hahafor onlin class document edit task
296,296,miss donbel bwhahaha eat mcdo ule onlin class donbel mcdonald
297,297,morn onlin yoga class setup glad teach remot wonder
298,298,rbf onlin class
299,299,lamiggg puta onlin class
300,300,onlin class hahahaha
301,301,onlin class student
302,302,die envi dlsu student walk hug friend class onlin class csb
303,303,onlin class hangov hehe
304,304,onlin class
305,305,ressi suddenli sang omsim barabidam omsim barabidam chuchu onlin class prof teach record video hahahahahaha
306,306,hey particip onlin class answer
307,307,wifi load onlin class
308,308,onlin class frustrat class nut
309,309,live manila juli allow onlin class allow school monday sunday haha
310,310,wow pray onlin class cost hahahaha pray
311,311,day onlin class
312,312,onlin class week
313,313,cri math hour onlin class eye pain shut
314,314,onlin class exam ftf shutaaa think traffic lazi school
315,315,day fair onlin class van heard class tuesday waaahhh ngl day unibersidad pilipina
316,316,feel tire onlin class sjheueuddbheeusbw
317,317,hope onlin class call
318,318,landlin internet teenag jusmio' onlin class fast team' repli action
319,319,class onlin hope prof util hour
320,320,hahahaha shame onlin class cassi share classmat
321,321,samsung tab mall price palang sya perfect onlin class charger black cover spec
322,322,hard onlin class stabl connect
323,323,lunc onlin class
324,324,onlin class
325,325,ftf award deserv haha studi onlin class satisfi studi cram hay haha
326,326,watch niec onlin class mom classmat tita angel beauti beauti love
327,327,hard attend onlin class huhuhu
328,328,onlin class sleepi
329,329,day return onlin class hahahahahah
330,330,onlin class
331,331,condo onlin class
332,332,connect campu panooh onlin class nubaaah yupielbi
333,333,onlin class colleg valueseducationteacheryarn
334,334,shame teacher school onlin class
335,335,onlin class lack skill follow disciplin
336,336,onlin class hahaha
337,337,onlin class
338,338,hahahaha slept onlin class hahahaha sowwiii
339,339,teacher onlin class hahahahahahahaha
340,340,realiz spent ftf class audac onlin
341,341,class onlin class
342,342,care onlin class week goodluck carrier tomorrow
343,343,student hybrid set burn hair onlin class travel subject hahahahaha neljam del rosario
344,344,hard gala onlin class bitch haha
345,345,lupi onlin class professor announc
346,346,wfh care care mom onlin class teach class wake day worth
347,347,trip manila week onlin class hehe
348,348,traffic onlin class huhu
349,349,onlin class aning zameco
350,350,cough huhu onlin class laptop hahaha
351,351,enter onlin class unabl attend
352,352,product onlin class shi video
353,353,time studi tabl onlin class studi bed hahaha
354,354,tire onlin class hahahahaha
355,355,manila onlin class gimmick
356,356,sister camil hope notic onlin class
357,357,sister heart cell phone onlin class hope notic
358,358,onlin class saturday teacherofinstagram teachersofig teachersfollowteach teachertrib alsteach alslif alsteachersgo santa rosa laguna
359,359,friday day onlin class nervou close finish
360,360,onlin class brew
361,361,bought onlin class onlin game told hahahahahaahaha
362,362,onlin class speech therapi idlip muna wait matt malolo matt therapi center
363,363,onlin class
364,364,tire onlin class
365,365,day onlin class stress
366,366,onlin class ftf mom dad break mental health yipey
367,367,onlin modular class rid anxieti
368,368,onlin class gala dabest
369,369,cri onlin class
370,370,onlin class hahahaah
371,371,class sampler serf week trial parent unsur child readi hyflex learn combin day facetofac day onlin sign
372,372,hahahahahaha cosm gurlzzz onlin class ahhahahah
373,373,onlin class
374,374,onlin class exam minimum min byah
375,375,happi day onlin class chz
376,376,readi onlin class
377,377,week start class miss unit live unsur class setup treat middl pandem onlin class dobetterup
378,378,forda ferson loss review write onlin class time
379,379,day onlin class tomorrow email process messi unorgan huhuhu pup' process bit tediou wors ucc
380,380,dodorm jusko onlin class suddenli dorm friend famili
381,381,onlin class flexibl spent time studi watch youtub read articl tuition paid era
382,382,hahhahaha rememb week lesson board drew town game includ load week onlin class
383,383,note toss handl komfil transfer teacher time semestr onlin class start
384,384,onlin class huh
385,385,realiz wast opportun onlin class
386,386,possess onlin class
387,387,onlin class week
388,388,onlin class issu internet connect
389,389,time encount winona' onlin class fortun week mess lol dizzi
390,390,onlin class
391,391,onlin class neglect class
392,392,understand onlin class lazi
393,393,attend onlin class hahahahahah
394,394,onlin class ggca christianschool zgim south signal villag taguig citi
395,395,brother colleg onlin class everyday
396,396,morn morn onlin class
397,397,kolsen eyjent guard onlin class real quick brgi bintog
398,398,understood easili onlin class
399,399,gara naka onlin class day day day actual
400,400,onlin class laptop projector nunaaa depe support
401,401,hard onlin class time
402,402,grade goodluck brainli onlin class
403,403,fell asleep onlin class
404,404,recommend onlin class suspend class typhoon hope
405,405,friend onlin class rawr
406,406,onlin class hurt eye head
407,407,friend asynchron onlin class teacher rain teambahay onlineclass firstdaycrazi firstdayofschool
408,408,bore onlin class
409,409,mom' chineck onlin class hahaha
410,410,onlin class wow wow wow ayocco
411,411,feel drain onlin class
412,412,onlin class storm
413,413,share school provid teacher laptop internet connect onlin class
414,414,onlin class food listen
415,415,stress onlin class hahaha
416,416,babi quiz babi time onlin class hahahahaha
417,417,onlin class
418,418,sound ambul tagalog class onlin class student wewowewo tagalog class teacher wiwiwiwi depe
419,419,privat school expens tuition onlin class student public school sanction privat school corrupt
420,420,nalag sulod lage kog onlin class sunodhahshwjajahahaha
421,421,daw tong onlin class oyyy
422,422,onlin class tire walk putchak
423,423,day onlin class brgi bintog
424,424,themorningrush firstdaycrazi schedul blend learn onlin class shame wear
425,425,onlin class
426,426,upset class tomorrow onlin class complain understand
427,427,onlin class luck continu enter tomorrow peopl
428,428,liboga ani metc teacher onlin class liboga
429,429,onlin class sad ghad
430,430,onlin class tom feel
431,431,onlin class hard
432,432,groceri shop ate food onlin class week hahshahshahaha
433,433,onlin class effect valid mamsh
434,434,church onlin class haha huhu lord
435,435,onlin class stress stress monday
436,436,kayang exam class exam esp onlin retool time limit amp correct answer synthesi learn class
437,437,onlin class school haha putek san classroom hahahaha
438,438,nah onlin class fuck
439,439,suppos nois onlin class
440,440,roller coaster ride week nuel recept onlin class haaay god friday
441,441,handl onlin class boost confid
442,442,tomorrow friday walay onlin class kuya kdrama haha episod atti woo
443,443,stress onlin class earlier
444,444,rent class in-person lot hybrid onlin cours
445,445,check onlin class
446,446,tilid onlin class hahaha
447,447,hey nervou tom onlin class approv huhu
448,448,holi fuckin shit glad school sleep fuck prof enjoy haha hard onlin class catch teacher' punchlin laugh hahahaha damn comfort
449,449,girl onlin class
450,450,rehearsalltonlin class
451,451,onlin class
452,452,onlin class dissatisfact
453,453,continuestart stori onlin class muna hehe prioriti purrr
454,454,shit onlin class sleepi
455,455,hope onlin class
456,456,studentathleg ferson tra onlin class
457,457,wifi arw hang onlin class drink cold shake ktvroom livemus freeplaybeerpong waze tresto pub tresto bar baño
458,458,onlin class tomorrow
459,459,motiv idea onlin class week twice' week
460,460,shutaena onlin class
461,461,onlin class school
462,462,onlin class
463,463,tire campu onlin class yesterday hahaha
464,464,onlin class
465,465,shout thesi closest stop semest tire semest truth enjoy vacat onlin class
466,466,ftf onlin class haha
467,467,depend prof hyblend school week onlin class
468,468,yay class arrang min facenext onlin class
469,469,attend onlin class lie hhahahaha
470,470,sleepi close eye hahha fortun onlin class char
471,471,onlin class tomorrow wake
472,472,mess aah onlin class tomorrow amanda daw hay taranta
473,473,day onlin class activ special gosh
474,474,issu fare bsu amp onlin class
475,475,sleep straight onlin class
476,476,lot conflict onlin class school
477,477,onlin class start tomorrow sheesh
478,478,classmat call hahaha listen onlin class
479,479,huuuyyy alcohol month hahaha hope hahaha onlin class mooor
480,480,arrog hhahahha onlin class colleg
481,481,hope onlin class class day
482,482,onlin class real
483,483,regular class colleg day onlin class extend day
484,484,onlin class kay
485,485,onlin class rin
486,486,onlin class hahhahaha
487,487,wawit term jusq onlin class hay
488,488,onlin class straight ketkai attend assembl chemco insigida kadawat yay chemco
489,489,class onlin experi
490,490,embarrass student pass entir class haha onlin platform recognit
491,491,haha onlin class crazi bwahahaha month bwahaha
492,492,delight excit virtual upcom onlin spiritu retreat graduat class mmccastmetronista
493,493,onlin class
494,494,hook hook hook onlin class babi
495,495,onlin class bet
496,496,fairview honor facetofac commenc speaker onlin graduat ceremoni congratul class aliv
497,497,onlin class classmat listen care epbi epbi dumbfound
498,498,onlin class haircut time hahaha
499,499,kind resid intern east ave asham doc dubiou knowledg skill onlin class
500,500,week babi class orient onlin onsit paref southcrest school
501,501,stay onlin class fun wait entranc volleybal court blame lot
502,502,onlin class classroom classroom straight middl jungl day fieldwork feel memori share care ivan
503,503,onlin class earrap
504,504,onlin class accla hahahahaha
505,505,edrich super struggl modul onlin class includ class consist daycar joy pride
506,506,jusmiyo apakayabang stand hope reach onlin class experi difficulti adjust class onlin class hope learn beauti manner class arrog
507,507,ebarg critic magna cum laud imit valedictori speech harsh comment read comment tiktok vid comment caught attent onlin class summa cum laud
508,508,stuck onlin class
509,509,onlin class
